tipo,mensaje
ham,"Vaya hasta Jurong Point, loco... Dispsoloble solo en Bugis n Great World La e Buffet... Cine tiene Amore Wat..."
ham,Ok... bromeando con u solo...
spam,Entrada gratuita en 2 una compensación de wkly para ganar la Copa FA final TKTS 21 de mayo de 2005. Texto FA a 87121 para recibir la pregunta de entrada (Tasa de TXT STD) Aplicar los T&C 08452810075Over18's
ham,No digo tan temprano... u c ya digo...
ham,"No, no creo que vaya a la USF, aunque vive por aquí"
spam,"Freemsg Hola, cariño, ¡ya han pasado 3 semanas y no hay palabra! ¿Me gustaría un poco de diversión por eso todavía? TB ok! XXX STD CHGS para enviar, £ 1.50 a RCV"
ham,Incluso mi hermano no es como hablar conmigo. Me tratan como una patente del SIDA.
ham,Según su solicitud 'Melle Melle (Oru Minnaminunginte Nurungu Vettam)' se ha establecido como su callertune para todas las personas que llaman. Presione *9 para copiar a sus amigos Callertune
spam,"¡¡GANADOR!! ¡Como cliente valioso de la red, ha sido seleccionado para recibir una recompensa del premio de £ 900! Para reclamar llame al 09061701461. Código de reclamación KL341. Válido 12 horas solamente."
spam,¿Tuvo su móvil 11 meses o más? ¡Tienes derecho a actualizar los últimos móviles de color con cámara de forma gratuita! Llame a la actualización móvil CO gratis al 08002986030
ham,"Voy a estar en casa pronto y ya no quiero hablar de estas cosas esta noche, K? He llorado lo suficiente hoy."
spam,"¡Seis oportunidades de ganar efectivo! De 100 a 20,000 libras txt> CSH11 y envíe a 87575. Costo 150p/día, 6 días, 16+ Tsandcs Aplicar respuesta HL 4 Información"
spam,"¡URGENTE! ¡Has ganado una membresía gratuita de 1 semana en nuestro premio premio de premios de £ 100,000! Txt La palabra: afirmar no: 81010 T&C www.dbuk.net lccltd POBOX 4403LDNW1A7RW18"
ham,He estado buscando las palabras correctas para agradecerle por este respiro. Prometo que no daré por sentado su ayuda y cumpliré mi promesa. Has sido maravilloso y una bendición en todo momento.
ham,¡Tengo una cita el domingo con voluntad!
spam,"XXXMOBILEMOVIECLUB: Para usar su crédito, haga clic en el enlace WAP en el siguiente mensaje TXT o haga clic aquí >> http: // wap. xxxmobilemovieclub.com?n=qjkgighjjgcbl"
ham,Oh K... estoy viendo aquí:)
ham,"Eh, ¿recuerdas cómo se deletrea su nombre? Sí, lo hice. Es travieso hasta que me mojo."
ham,Bien si esa es la forma en que te sientes. Así es como se cae b
spam,"Inglaterra V Macedsoloa - No se pierda las metas/noticias del equipo. TXT UR Equipo nacional a 87077 EG Inglaterra a 87077 Try: Gales, Escocia 4TXT/Ú1.20 POBOXOX36504W45WQ 16+"
ham,¿Es eso en serio cómo se deletrea su nombre?
ham,Voy a intentar por 2 meses ja ja ja solo bromeando
ham,"Entonces, paga primero... Luego, ¿cuándo vendrán las acciones?"
ham,A popa termino mi almuerzo y luego me voy a bajar. ARD 3 SMTH LOR. ¿Ya terminaste tu almuerzo?
ham,"Fffffffff. ¿Está bien, no hay manera de que pueda reunirme contigo antes?"
ham,Me obligué a comer un trozo. Aunque realmente no tengo hambre. Esto apesta. Mark se está preocupando. Él sabe que estoy enfermo cuando rechazo la pizza. Jajaja
ham,Jajaja siempre eres tan convincente.
ham,¿Cogiste el autobús? ¿Estás friendo un huevo? ¿Hiciste un té? ¿Estás comiendo la cena de tu madre? ¿Sientes mi amor?
ham,"Estoy de vuelta y amp; Estamos empacando el auto ahora, te haré saber si hay espacio"
ham,Ahhh. Trabajar. ¡Recuerdo vagamente eso! ¿Cómo se siente? Jajaja
ham,"Espera, eso todavía no está tan claro, ¿no estaba seguro de que yo fuera sarcástico o por eso X no quiere vivir con nosotros?"
ham,"Sí, entró a las 2 y se disculpó en V. N se había caído y ella activa como un niño malcriado y él quedó atrapado en eso. ¡Hasta las 2! ¡Pero no iremos allí! No hacer malas vítores. ¿Tú?"
ham,K dime algo sobre ti.
ham,¿Por miedo a desmayarse con todas esas tareas domésticas que acabas de hacer? Rápido tener una taza
spam,"Gracias por su suscripción a Ringtone UK a su móvil se le cobrará £ 5/mes, confirme respondiendo sí o no. Si responde no, no se le cobrará"
ham,"Sí... ok, voy a casa Mira los tiempos, luego me morteo ü de nuevo... Xuhui va a aprender en el 2 de mayo también, pero su lección es a las 8 a.m."
ham,"Ups, te haré saber cuando haya terminado mi compañero de cuarto"
ham,Veo la letra B en mi coche
ham,Cualquier cosa para... tú decides...
ham,¡Hola! ¿Cómo estás y cómo fue el sábado? Estaba enviando mensajes de texto para ver si había decidido hacer algo Tomo. ¡No es que esté tratando de invitarme a mí mismo ni a cualquier cosa!
ham,Por favor continúe con los vatios. Sólo quería estar seguro. Que tengas un gran fin de semana. abiola
ham,"¿Olvidé decirte? Te quiero, te necesito, te anhelo... pero sobre todo... te amo mi dulce corcel árabe... mmmmmm... delicioso"
spam,07732584351 - Rodger Burns - Msg = Intentamos llamarlo con su respuesta a nuestro SMS para una videocámara gratuita de Nokia Mobile + GRATIS. Llame ahora 08000930705 para la entrega mañana
ham,¿A quién ves?
ham,¡Excelente! Espero que te guste tu hombre bien dotado. Soy & lt;#& gt; pulgadas...
ham,Sin llamadas... Messages..
ham,¿No te vacunaron contra la hepatitis B en Nigeria?
ham,"Justo, ¿algo que pasa?"
ham,"Sí, con suerte, si Tyler no puede hacerlo, tal vez podría preguntar un poco"
ham,No sabes lo terco que soy. Ni siquiera quería ir al hospital. Seguí diciéndole a Mark que no soy un tonto débil. Los hospitales son para retoños débiles.
ham,Lo que pensaste de mí. La primera vez que me viste en clase.
ham,"Un gramo generalmente corre como & lt;#& gt; Sin embargo, una media octava es más inteligente y te consigue casi un segundo gramo entero para & lt;#& gt;"
ham,"K FYI X tiene un viaje temprano mañana por la mañana, pero se está estrellando en nuestro lugar esta noche"
ham,"Guau. Nunca me di cuenta de que estabas tan avergonzado por tus alojamientos. Pensé que te gustaba, ya que estaba haciendo lo mejor que pude y siempre parecías muy feliz con ""la cueva"". Lamento no haberlo hecho y no tengo más que dar. Lamento haber ofrecido. Lamento que tu habitación fuera tan avergonzante."
spam,Sms. AC SPTV: Los New Jersey Devils y los Detroit Red Wings juegan hockey sobre hielo. ¿Correcto o incorrecto? ¿Fin? Respuesta Fin SPTV
ham,¿Sabes lo que hizo Mallika Sherawat ayer? Descúbrelo ahora @ & lt; url & gt;
spam,"¡Felicitaciones! 1 año Special Cinema Pass para 2 es tuyo. ¡Llame al 09061209465 ahora! C Suprman V, Matrix3, Starwars3, etc. ¡Todos 4 gratis! BX420-IP4-5WE. 150pm. ¡No te pierdas!"
ham,"Lo siento, llamaré más tarde en la reunión."
ham,Dile a donde llegaste
ham,Sí... Gauti y Sehwag fuera de la serie ODI.
ham,Tendrás que recoger una hamburguesa de $ 1 por ti mismo en tu camino a casa. Ni siquiera puedo moverme. El dolor me está matando.
ham,"Ja, ja, ja, buena broma. Las niñas son buscadoras de situación."
ham,Es parte de la comprobación de IQ
ham,"Lo siento, mis compañeros de cuarto tomaron una eternidad, ¿está bien si vengo por ahora?"
ham,Ok Lar I Double Check Wif da Hairer Ya Dijo Wun Cut V Brew. Dijo que cortará hasta que me vea bien.
spam,"Como cliente valioso, me complace informarle que después de la reciente revisión de su mafia No. se le otorga un premio de bsoloficación de £ 1500, llame al 09066364589"
ham,"Hoy es ""Song Dediced Day.."" ¿Qué canción dedicarás a mí? Envíe esto a todos sus valiosos amigos pero primero me plantea..."
spam,"Ur Ur otorgó un viaje de cortesía a Eurodisinc Trav, ACO & Entry41 o £ 1000. Para reclamar txt dis a 87121 18+6*£ 1.50 (Morefrmmob. Shracomorsglsuplt) 10, LS1 3AJ"
spam,"¿Escuchaste sobre el nuevo ""Divorce Barbie""? ¡Viene con todas las cosas de Ken!"
ham,Me avenzo para dar el final de este mes.
ham,Wah Man Lucky... luego puede ahorrar dinero... ji...
ham,Terminada la clase ¿dónde estás?
ham,"Hola nena, estoy en casa ahora, ¿quieres hacer algo? Xx"
ham,K..K:) ¿Dónde estás? ¿Cómo te desempeñaste?
ham,Puedes llamarme ahora...
ham,Estoy esperando a Machan. Llámame una vez que te liberes.
ham,Eso es genial. Soy un caballero y te trataré con dignidad y respeto.
ham,Me gustan mucho los pueblos:) pero soy muy tímida.
ham,No funciona después de & lt;#& gt; o que
ham,No es lo mismo aquí. Todavía estoy buscando trabajo. ¿Cuánto gana TA allí?
ham,"Lo siento, llamaré más tarde"
ham,K. ¿Me llamaste justo ahora ah?
ham,"Ok, estoy de camino a casa hola hola"
ham,Estarás en el lugar de ese hombre
ham,"Sí, la siguiente parada."
ham,"Te llamo más tarde, no tengo red. Si urgnt, sms me."
ham,¿De verdad cuando te estás molestando? Sólo necesito 2 entradas más y una chaqueta más y listo. Ya usé todos mis multis.
ham,"Sí, comencé a enviar solicitudes para hacerlo, pero el dolor regresó, así que estoy de vuelta en la cama. Monedas dobles en la fábrica también. Tengo que cobrar todos mis nitros."
ham,Realmente no estoy preparado para eso esta noche nena
ham,"Ela Kano., Descarga, ven cuando eres gratis.."
ham,"¡Sí, hazlo! ¡No se pare para cerrar aunque atraparás algo!"
ham,Lamento ser un dolor. ¿Está bien si conocemos otra noche? Pasé tarde en la víctima y eso significa que no he hecho ninguna de Y Stuff42moro y eso incluye todas mis hojas de tiempo y eso. Lo siento.
ham,Sonríe en placer Sonríe en dolor Sonríe cuando los problemas se vierten como la lluvia sonríe cuando la suma1 duele la sonrisa porque ¡¡¡¡¡¡¡¡¡¡¡¡¡¡¡¡¡¡¡¡¡¡¡¡¡¡¡¡¿
spam,"¡Llame a nuestro representante de servicio al cliente al 0800 169 6031 entre las 10 a.m. y las 9 p.m., ya que ha ganado un premio garantizado de £ 1000 en efectivo o £ 5000!"
ham,No tengo pensado comprar más tarde. Ya verifiqué que solo tuve 530 shows en la tarde. ¿Ya terminaste el trabajo?
spam,"Su tono de llamada gratuito está esperando a ser recogido. Simplemente envíe un mensaje de texto con la contraseña ""MIX"" al 85069 para verificarla. Trae a Usher y Britney. FML, apartado postal 5249, MK17 92H. 450 personas 16"
ham,Viendo la película Telugu...
ham,Veo. Cuando terminamos tenemos muchos préstamos para pagar
ham,"Hola. WK ha estado bien, ¡en Hols ahora! Sí, por un poco de carrera. Olvidé que tengo una cita de peluquería a las cuatro, así que debo llegar a casa y ducharse de antemano. ¿Eso te causa problemas? """
ham,Veo una taza de animación de café
ham,"Por favor, no me envíes un mensaje de texto más. No tengo nada más que decir."
ham,"¡Está bien, indica tu precio siempre que sea legal! ¿Puedo recogerlos? Tienes x ams xx"
ham,Todavía estoy buscando un auto para comprar. Y todavía no he pasado el examen de conducir.
ham,"Guau. ¡Tienes razón! No quise hacer eso. Supongo que una vez que renuncié a los hombres de Boston y cambié mi ubicación de búsqueda a Nueva York, algo cambió. Porque en mi página de firmar, todavía dice Boston."
ham,Umma mi vida y vava umma te amo mucho querida
ham,Muchas gracias por tus deseos en mi cumpleaños. Gracias por hacer que mi cumpleaños sea realmente memorable.
ham,"Aight, te golpearé cuando obtenga algo de efectivo"
ham,¿Cómo probaría mi dirección IP que considerar mi computadora no es un servidor de Minecraft?
ham,"¡Lo sé! Ancianos gruñones. Mi madre era como si no estuvieras mintiendo. Por otra parte, siempre soy el que juega bromas..."
ham,No te preocupes. Supongo que está ocupado.
ham,¿Cuál es el plural de la investigación del sustantivo?
ham,Yendo a cenar.mg te después.
ham,"Estoy bien con it, porque me gustan 2 probar cosas nuevas. Pero te asusté como mah. Porque dijiste que no es demasiado fuerte."
spam,¡CABALLERO! Estamos tratando de contactarlo. Los fines de semana los fines de semana los fines de los fines de los fines de los fines de los fines de los fines de semana ganaste un premio de £ 1000 garantizado. Llame al 09064012160. Código de reclamación K52. Válido 12 horas solamente. 150 ppm
ham,"Wa, tu oración abierta muy formal... de todos modos, también estoy bien, juz, estoy comiendo demasiado y en peso... jaja... ¿entonces sucedió cualquier especial?"
ham,"Cuando entré en mi cabaña, mi PA dijo: ""¡Feliz B'day Boss!"". Me sentí especial. Ella me pidió 4 almuerzo. Después del almuerzo, me invitó a su departamento. Fuimos allí."
spam,Usted es un ganador que ha sido seleccionado especialmente 2 Recibe £ 1000 o 4* Holiday (Flights Inc) Hable con un operador en vivo 2 Reclamación 0871277810910p/min (18+)
ham,"¡Vaya! Sí, debemos hablar el viernes: ¡la relación de potato de huevo para la tortilla necesaria!"
ham,"Hmm... mi tío me solo informó que está pagando a la escuela directamente. Entonces, por favor, compre comida."
spam,¡PRIVADO! Su estado de cuenta de 2004 para 07742676969 muestra 786 puntos de bsoloficación no canjeados. Para reclamar llamar al 08719180248 Código Identificador: 45239 Caduca
spam,"¡URGENTE! Su número de móvil recibió el Premio de la Llamadora de Bonos de £ 2000 el 5/9/03 ¡Este es nuestro último intento de contactar a U! Llame desde el campo 09064019788 box42wr29c, 150ppm"
ham,Aquí está mi nueva dirección: Apple y pares y todo ese malky
spam,"Los números de Voda de hoy que terminan 7548 son seleccionados para recibir un premio de $ 350. Si tiene una coincidencia, llame al 08712300220 citando el código de reclamación 4041 Aplicación de tarifas estándar"
ham,Hoy voy a Sao Mu. Se hará solo a las 12
ham,Ü Predecir el tiempo ü terminará de comprar?
ham,"Cosas buenas, lo haré."
ham,"Para que lo sepas, Yetunde aún no ha enviado dinero. Acabo de enviarle un mensaje de texto para no molestarse en enviar. Así que se acabó, no tienes que involucrarte en nada. No debería haberte impuesto nada en primer lugar, así que por eso, me disculpo."
ham,¿Estás ahí en la habitación?
ham,Hola chica. ¿CÓMO ESTÁS? ¡Espero que me hayas bien un Del R Bak! De nuevo mucho tiempo no c! Dame una suma de llamada de Lucyxx
ham,K..K:) ¿Cuánto cuesta?
ham,Estoy en casa.
ham,"Estimado, llamaré a TMorrow.PLS acomodado."
ham,Primero responde mi pregunta.
spam,Sunshine Quiz Wkly Q! ¿Gana un jugador de DVD de Sony si sabes en qué país se encuentra el Algarve? TXT ANSR a 82277. £ 1.50 SP: Tyrone
spam,"¿Quieres que se pongan 2 esta noche? ¿Quieres ubicaciones reales de perros enviadas directamente a tu mafia? ¡Únase a la red de perros más grande del Reino Unido, BT Txting Gravel a 69888! Nuevo Testamento. EC2A. 31p.msg@150p"
ham,Solo tengo msn. Es yijue@hotmail.com
ham,Él está ahí. Llamas y lo conoces
ham,No no. Revisaré todas las habitaciones antes de las actividades
spam,"No RCV más MSGS del chat svc. Para obtener servicios de servicios hardcore gratuitos, vaya a: 69988 Si no obtienes nada, debes envejecer con la red de YR y vuelva a intentarlo"
ham,Tengo C... ¿Flojo para escribir... Olvidé ü en Lect... Vi una bolsa pero como no es agradable...
ham,"K, envíame un mensaje de texto cuando estés en camino"
ham,"Señor, esperando su correo."
ham,"Un pensamiento de swt: ""Nver se cansa de hacer pequeñas cosas 4 personas adorables..."" porque a veces esas pequeñas cosas ocupan la parte más grande en sus corazones... gud ni8"
ham,Sé que eres. ¿Puedes abrir la parte posterior?
ham,Si no te vemos en el punto
ham,¿Cuál es el nombre del personal que nos está tomando clase?
spam,"Freemsg, ¿por qué no has respondido a mi texto? Soy randy, sexy, mujer y vivo local. Me encanta saber de ti. NetCollex Ltd 08700621170150p por Msg Responder Parada para finalizar"
ham,"Ummma. Llamará después del check in. Nuestra vida comenzará desde Qatar, así que por favor reza mucho."
ham,K..menté mi contacto por qué?
ham,Sindu consiguió trabajo en Birla Soft.
ham,El vino está fluyendo y yo nunca he tenido...
ham,"Sí, creo que el cine es mejor porque no es necesario bajar 2 plazas mah."
ham,Ok... tu respuesta típica...
ham,"Estás en todas partes, la tierra, en el piso, las ventanas, incluso en mi camisa. Y a veces, cuando abro la boca, eres todo lo que viene fluyendo. Sueño con mi mundo sin ti, entonces la mitad de mis tareas también están fuera. Un tiempo de alegría para mí, muchos programas de televisión que verán. Pero supongo que todas las cosas que debes existir, como la lluvia, el granizo y la niebla, y cuando mi tiempo aquí está hecho, tú y yo nos convertimos en uno."
ham,"Aaoooright, ¿estás en el trabajo?"
ham,Me voy de casa ahora...
ham,Hola mi amor. ¿Qué estás haciendo? ¿Llegaste a esa entrevista hoy? ¿Eres tú feliz? ¿Estás siendo un buen chico? ¿Piensas en mí? ¿Me estás extrañando?
spam,Annsolocio de servicio al cliente. Tienes una entrega de Año Nuevo esperándote. Llame al 070467444435 ahora para organizar la entrega
spam,Usted es un ganador que ha sido seleccionado especialmente 2 Recibe £ 1000 en efectivo o unas 4* Holiday (Flights Inc) Hable con un operador en vivo 2 Reclamación 0871277810810
ham,Manténgase a salvo para mí porque te necesito y ya te extraño y envidio a todos los que te ven en la vida real
ham,Auto nuevo y casa para mis padres.:) Tengo solo un nuevo trabajo en la mano:)
ham,Estoy tan enamorado de ti. Estoy emocionado cada día que paso contigo. Me haces tan feliz.
spam,-PLS STOP bootydelious (32/F) te está invitando a ser su amiga. Responde SÍ-434 o NO-434 Verla: www.SMS.ac/u/bootydelious ¿PARAR? Enviar STOP FRND al 62468
spam,"Bangbabes tu pedido está en camino. Debería recibir un servicio Msg 2 Descargue su contenido. Si no lo haces, geto wap. Bangb. TV en su menú de Internet/servicio móvil"
ham,Ya coloco todos sus puntos en el módulo de culturas.
spam,¡URGENTE! Estamos tratando de contactarlo. Los fines de semana los finales de los fines de los fines de los fines de los fines de los fines de los fines de los fines de semana han ganado un premio de £ 900 garantizado. Llame al 09061701939. Código de reclamación S89. Válido 12 horas solamente
ham,"Hola, Frnd, ¿cuál es la mejor manera de evitar el desacuerdo con nuestro amado?"
ham,Gran escape. Me imagino el puente pero necesita su cerveza. Nos vemos tomo
ham,Sí:)está completamente fuera de forma:)clark también es un desperdicio total.
ham,"Señor, necesito el número de cuenta de AXIS BANK y la dirección del banco."
ham,"Hmmm... seguro que tengo tiempo para saltar... ya, puedes ir 4 gratis abt... muz llamándote para discutir liao..."
ham,¿A qué hora bajas más tarde?
ham,"Demsoloos sangrientos, no puedo creer que olvidaste mi apellido Sr. Te daré una pista, su español y comienza con M..."
ham,"Bueno, ahora voy a terminar mi baño. Que tengas una buena... buena noche."
ham,Avísame cuando tienes el dinero para que Carlos pueda hacer la llamada
ham,¿Todavía vas al centro comercial?
ham,"Resulta que mis amigos se quedan para todo el espectáculo y no volverán a Til ~ & lt;#& gt;, así que siéntete libre de seguir adelante y fumar ese $ & lt;#& gt; valer"
ham,"Enviarle un mensaje de texto. Si ella no responde, avíseme para que pueda tener su inicio de sesión"
ham,¡Hola! Acabas de hablar con Maneesha V. Nos gustaría saber si estabas satisfecho con la experiencia. Responder peaje gratis con sí o No.
ham,"Levantaste mis esperanzas con la oferta de dinero. Lo estoy necesitando. Especialmente cuando el fin de mes se acerca y me duele el estudio. De todos modos, ten un fin de semana GR8"
ham,Jajaja no. Puedes confiar en mí.
ham,Ok. Soy un caballero y te trataré con dignidad y respeto.
ham,"Lo hará, ustedes cierran?"
ham,No pasa nada genial.
ham,Hola guapo! ¿Estás encontrando ese trabajo? ¿No ser vago? ¿Trabajando para recuperar esa red para mamá? ¿Dónde está mi juguete ahora? ¿Me extraña?
ham,"Jaja impresionante, estar allí en un minuto"
spam,"¡Llame a nuestro representante de servicio al cliente en Freephone 0808 145 4742 entre 9 a.m. y 11 p.m., ya que ha ganado un premio garantizado de £ 1000 en efectivo o £ 5000!"
ham,"¿Tienes los tiempos de radio de Navidad? Si no, lo conseguiré ahora"
ham,Yo llegué a casa. Voy a bañarme primero. Pero mi hermana usando la red te diga cuando termina K...
spam,¿Eres lo suficientemente único? Descúbrelo a partir del 30 de agosto. www.areyouunique.co.uk
ham,Lo lamento. Me he unido a la liga de personas que no se mantienen en contacto. Te refieres mucho a mí. Has sido un amigo en todo momento incluso a gran costo personal. Que tengas una gran semana.
ham,Hola:) finalmente completé el curso:)
ham,"Se detendrá sobre sí mismo. Sin embargo, sugiero que se quede con alguien que pueda dar OR por cada taburete."
ham,¿Cómo estás? Espero que se haya instalado para el nuevo año escolar. Solo te deseo un día gr8
ham,"Gud mrng querida, tengo un buen día"
ham,¿Recibiste la historia de esa persona?
ham,"¿Tu hámster está muerto? Oye, entonces, ¿te encuentro a la 1pm Orchard MRT?"
ham,"Hola, es Kate, ¿cómo está tu noche? Espero poder verte mañana por un momento, ¡pero tengo que sangriento babyjontet! Txt de regreso si puedes.:) xxx"
ham,"Lo encontré, enc & lt;#& gt;, ¿Dónde estás?"
ham,Te envié <#> dólares
ham,"Hola cariño, he terminado la universidad ahora, así que envíame un toque cuando termines si puedes amar a Kate xxx"
ham,Su cuenta ha sido rellenada con éxito por INR & lt; Decimal & Gt;. El saldo de su cuenta prepaga de KereralAcircle es RS & lt; decimal & gt;. Su ID de transacción es Kr & lt;#& gt;.
ham,Buenos días durmiendo GA.
ham,Me llamas alter a las 11 ok.
ham,Ü Diga hasta que me guste comprar Ericsson Oso no puede oredi...
ham,"Aight yo, dats dogg recto"
ham,Usted por favor danos conexión hoy en sí mismo antes y lt; decimal & gt; o reembolsar la factura
ham,"Ambos:) Disparo grandes cargas, ¡así que prepárate!"
ham,"Qué pasa Bruv, espero que hayas tenido un gran descanso. Ten un semestre gratificante."
ham,Inicio para que siempre podamos chatear
ham,K:) K:) bueno:) Estudie bien.
ham,Sí... ¿Cómo? Noe leh...
ham,¡Suena genial! ¿Estás en casa ahora?
ham,"Finalmente, el partido se dirige hacia el dibujo como su predicción."
ham,Cansado. No he dormido bien las últimas noches.
ham,Fácil ah? Sen recibió seleccionado significa que es bueno..
ham,Tengo que tomar un examen con el 3 de marzo
ham,"Sí, deberías. Creo que ahora puedes usar tu cajero automático GT para registrarse. No estoy seguro, pero si hay de alguna manera, puedo ayudarme a informarme. Pero cuando esté seguro de que está listo."
ham,Ok no hay problema. Tómate tu tiempo.
ham,Hay un sistema operativo llamado UBANDU que se ejecutará sin instalar en el disco duro... puede usar ese sistema operativo para copiar los archivos importantes en el sistema y darlo al taller de reparación.
ham,"Lo siento, llamaré más tarde."
ham,"Dices leh... por supuesto que no pasa nada. No digo V romántico jus un poco solo para. Estoy en el paisaje de la Nite, no tan bsoloto leh."
spam,"500 nuevos móviles de 2004, ¡debe irse! Txt: Nokia to no: 89545 y recoge el tuyo hoy! De solo £ 1 www.4-tc.biz 2optout 087187262701.50gbp/mtmsg18"
ham,Realmente apreciaría si me llamas. Solo necesito a alguien con quien hablar.
spam,"¿Conocerás pronto a tu compañero de ensueño? ¿Está tu carrera en 2 un comienzo de Flyng? 2 Descubra gratis, txt Horo seguido de su signo de estrella, e. gramo. Horo Aries"
ham,Hola compañía Elama Po Mudyadhu.
ham,"La vida es más estricta que el maestro... BCOZ El maestro enseña lección y amp; Luego realiza el examen, pero la vida primero realiza el examen y amp; luego enseña lecciones. Feliz mañana..."
ham,Querido buenos días ahora solo estoy despierto
ham,Bájese en Gandhipuram y camine para Cross Cut Road. Lado derecho & lt;#& gt; Street Road y gire a la primera derecha.
ham,Estimado vamos a nuestro lugar de goma
ham,"Lo siento, la batería murió, sí, estoy aquí"
ham,Sí:) Aquí la televisión siempre está dispsoloble en el lugar de trabajo.
spam,"Enviar mensajes de texto y conocer a alguien sexy hoy. Puedes encontrar una fecha o incluso coquetear, hasta U. Únete a 4 solo 10p. Responder con nombre y edad, por ejemplo, Sam 25. 18 -Msg Recd@ThirtyEight Pence"
ham,Lo he impreso oh. So & lt;#& gt; Ven arriba
ham,O estaré un poco más cerca como en la parada de autobús en la misma calle
ham,¿Dónde estás? ¿Cuándo llegarás aquí?
ham,"Nueva teoría: el argumento gana una situación, pero pierde a la persona. Así que no discutas con tus amigos solo..... patearlos y amp; Digamos, siempre estoy en lo correcto."
spam,U 447801259231 tiene un admirador secreto que está mirando 2 contacto con U-Find Out Who They R*revela quién piensa que eres tan especial al 09058094597
ham,"Audiencia final de Tomarrow en mi caso de laptop, así que no puedo."
ham,Pleassssssseeeeee Tel me v Avent Done Sportsx
ham,"Bueno. No, no, solo brillando. Eso estaba destinado a firmar, pero eso suena mejor."
ham,"Aunque te dije que ahora estoy en Baig Face Watches, pero realmente me gusta E Watch You Ded porque es de su parte. Gracias 4 todo lo que has hecho hoy, estoy tocado..."
ham,¿No recuerdas ese viejo comercial?
ham,Demasiado tarde. Dije que tengo el sitio web. No tenía o no tengo las zapatillas
ham,Te pedí que lo llamara ahora bien
ham,Kallis no bateará en 2ª entradas.
ham,No volvió a funcionar oh. ok buenas noches entonces. Lo arreglaré y lo tendré listo para cuando te despiertes. Te extrañamos mucho que tengas una buena noche de sueño.
spam,Felicitaciones Ur otorgaron 500 cupones de CD o 125 Garantizados y GRATIS Entrada 2 100 WKly Dibuje Música TXT a 87066 TNCS www.ldew.com1win150ppmx3age16
ham,Ranjith Cal DRPD Deeraj y Deepak 5min Hold
ham,"Cuando son adorables bcums enojados con lo que no lo tome en serio... porque estar enojado es la forma más infantil y verdadera de mostrar afecto profundo, cuidado y luv!.. Kettoda Manda... que tengas un buen día."
ham,¿Qué estás haciendo? ¿Cómo estás?
