tipo,mensaje
ham,"Hombre, este autobús es muy lento. Creo que vas a llegar antes que yo"
ham,"Espero que este mensaje de texto te encuentre sonriendo. Si no, deja que este texto te dé una razón para sonreír. Que tengas un hermoso día."
ham,"En caso de que te despiertes preguntándome dónde estoy, olvidé que tengo que cuidar algo para la abuela hoy, debe hacerse antes del desfile"
spam,"¡Último Nokia Mobile o iPod MP3 Player +£ 400 Proze garantizado! Respuesta con: ¡Gana a 83355 ahora! Norcorp Ltd. £ 1,50/mtmsgrcvd18+"
spam,"Servicios de SMS. Para sus créditos de texto inclusivos, PLS GOTO www.comuk.net login = 3qxj9 Unfrison la suscripción con Stop, sin cargo adicional. Ayuda 08702840625.comuk. 220 cm2 9ae"
ham,NVM Toma tu tiempo.
ham,¿Entonces la decisión de Wat?
ham,"¿Qué estás 2, entonces, perra?"
ham,Ella le dijo a HR que él quiere publicar en Chennai:) porque estoy trabajando aquí:)
spam,Club móvil: elija cualquiera de los elementos de mejor calidad para su móvil. 7CFCA1A
ham,¿Cuándo se van?
ham,Él se queja pero me entristece para... ji... compre tmr para almuerzo después. Pero todavía nos encontramos con 4 almuerzo tmr a no. Neva escucha de ellos lei. Ü ¿Tienes mucho trabajo AR?
ham,No puedo hacer nada.
ham,Ü Takin Linear Algebra hoy?
ham,Este fin de semana está bien (una excusa para no hacer demasiada decoración)
ham,"Lo siento, te extrañé nena. Llegué tarde y dormí. Espero que disfrutes tu lección de conducir, Boytoy. Yo también te extraño... *burlando beso *"
ham,"Ahora Proyecto PA. Después de eso, solo yo puedo venir."
spam,Dinero que he ganado el número de victoria 946 wot do lo hago a continuación
ham,"Claro, cada vez que muestras el joder y gt;:("
ham,"Eso fue al azar, vio a mi antiguo compañero de cuarto en el campus. El graduado"
ham,"Los hombres siempre necesitan una esposa hermosa, inteligente, cariñosa, amorosa, ajustable y cooperativa. Pero la ley solo permite a una esposa..."
ham,"Eso apesta. Entonces, ¿qué te han planeado tu Valentín? Yo soy tu San Valentín, ¿no?"
ham,"Acabo de obtener parte Nottingham - 3 horas 63 millas. Menos mal que amo tanto a mi hombre, pero solo hago 40 mph. Hola Ho"
ham,Qué pensar que nadie dice claramente. ok no necesidad de preguntarle. Iré si ella viene o no
ham,"Hola, buenos días. Gracias. Te deseo lo mismo."
ham,¿Quieres 2 reunirte 2MORRO
ham,"En realidad decidí que tenía demasiado hambre, así que aún no me he ido: V"
ham,He enviado ü mi parte..
ham,Porque estaba de compras con darren jus ahora y lo llamé 2 preguntarle lo presente que él era lor. Luego comenzó a adivinar quién era el con y finalmente adivinó a Darren Lor.
spam,"¡Quiero un poco de polla! Mi esposo está fuera, necesito un hombre de verdad 2 me satisfacen. Esposa txt a 89938 para ninguna acción de cadenas. (TXT Stop 2 End, TXT Rec £ 1.50ea. OTBOX 731 LA1 7WS)."
ham,Entender. Su pérdida es mi ganancia:) ¿Entonces trabajas? ¿Escuela?
ham,¿CÓMO ESTÁS? ¡Te he extrañado! ¡No he estado en 2 mucho aburrido con el Holiday Want 2 Go Bak 2 College! Triste ¿no es? Xx
ham,"Hola, probablemente llegue a casa * fin de semana después del próximo"
ham,No olvides que te amo... y camino a tu lado. Cuidarte de ti y mantener tu corazón caliente.
ham,"Ojalá las cosas fueran diferentes. Me pregunto cuándo podré mostrarte cuánto te valoro. Por favor continúe con los caminatas rápidas sin drogas sin preguntarme, por favor y encuentre cosas de las que reír. Te amo mucho."
ham,"Ok, ambos días. Entonces, ¿qué estás haciendo para cenar tsolote? ¿Estoy invitado?"
spam,GR8 NUEVO SERVICIO - Video de sexo en vivo en su mafia - Vea las chicas más sexys más sexys en vivo en su teléfono - 4 Detalles Envíe un mensaje de texto Curryy a 89070 para cancelar la parada de envío a 89070
ham,No tengo dinero 4 Steve Mate!!
ham,Llegué tarde a Tellmiss estoy en camino
ham,Nunca culpes a un día de tu vida. Los buenos días te dan felicidad. Los malos días te dan experiencia. ¡Ambos son esenciales en la vida! ¡Todos son bendiciones de Dios! buen día.:
ham,Normalmente suelo beber más agua al día:)
ham,Me atrevo a preguntar... ¿alguna suerte al clasificar el auto?
ham,"La fiesta está en mi casa en la USF, sin cargo (pero si puede contribuir de alguna manera, es muy apreciada) y sí, tenemos espacio para uno más"
ham,"Urgh, entrenador caliente, huele a grasa de chips! Gracias de nuevo, especialmente por el edreder (no una palabra de texto predictiva)."
ham,Hola. ¿Cómo estuvo anoche? He sido travieso y me compré ropa y muy poco... ¡listo para más compras aunque! ¿Qué tipo de tiempo quieres conocer?
spam,Freemsg hola bebé wow acaba de tener una nueva cámara moby. ¿Quieres c una foto caliente? ¿O te apetece un chat? Estoy w8in 4utxt / rply chat con 82242 HLP 08712317606 MSG150P 2RCV
ham,He estado tratando de alcanzarlo sin éxito
ham,¿Cuándo hiciste tú y Derek con clase?
ham,Nunca y lei... yo v perezoso... ¿tienes wat? Dic Day ü Enviarme Da Url No puedo trabajar uno...
ham,Nunca intentes solo tomar el peso de una lágrima que sale de tu corazón y cae a través de tus ojos... siempre recuerda que un amigo estúpido está aquí para compartir... BSLVYL
ham,Hola amigo. Habló con la gente mag. Estamos encendidos. Se entrega a finales de mes. Entregar el 24 de septiembre. Hablar más tarde.
ham,Espero que estés teniendo una buena semana. Solo registrando
ham,"Jaja, mi amigo Tyler literalmente solo preguntó si podías conseguirle un dubsack"
ham,¡Ey! ¿Te apetece encontrarme a las 4 en Cha tiene una pequeña bebida sobre mí? Si no es txt o me llamamos y podemos encontrarnos L8R. bastante cansado entró en 3 v.pist;) amor pete x x x
ham,Excelente. Tener un viaje seguro. No se entreguen en pánico a todos.
ham,"Síntomas Cuando estás enamorado: ""1.u como escuchar canciones 2.u deténgase donde vea el nombre de su amado 3.u no se enojará cuando su"
ham,Sun Ah... el Mayb puede si Dun tiene algo en... There tiene que reservar la lección... E Pilates está en Orchard Mrt U noe...
ham,Intenta hacer algo querido. Lees algo para los exámenes.
ham,Gettin rdy para enviar comp
ham,Estoy en el hospital da.. Volveré a casa por la noche
ham,Piss está hablando es alguien que te das cuenta de que señala esto es eso (ahora léalo al revés)
ham,Piense + da. Lo harás.
ham,Estoy despierto oh. Qué pasa.
ham,Buenas tardes mi boytoy. ¿Cómo va eso caminar aquí y allá? ¿Conseguiste ese resumen de la policía? ¿Todavía estás fuera de casa? Te despierto y te extraño nena
ham,¿Cuánto intentas conseguir?
ham,"Ven y lt; decimal & gt; PM Vikky... Estoy Otside NW, Vengo por el momento"
ham,Dime de nuevo cuál es tu dirección
ham,"¿Debería comprarle un BlackBerry Bold 2 o una antorcha? ¿Debo comprarle nuevo o usado? Hágamelo saber. Además, ¿estás diciendo que debería comprar el & lt;#& gt; g csolo iPad. ¿Y qué estás diciendo sobre el sobre & lt;#& gt; ¿gramo?"
ham,"Pero estuvieron juntos, así que deberías pensar en él"
ham,"Hola, ¿cómo te va en el soleado África? Espero que hayas un buen momento. Devuélvete a esa gran plata vieja un gran beso de mi parte."
ham,¿A qué hora debo venir mañana?
spam,¿Quieres reír? ¡Prueba chit-chat en tu móvil ahora! Iniciar sesión txtando la palabra: chatear y enviarla al no: 8883 cm PO Box 4217 Londres W1A 6ZF 16+ 118P/MSG RCVD
ham,"¡Cha cuátilizando a esa nena scool, probpop in & cu satthen hunny 4brekkie! Amor Jen XXX. PSXTRA LRG PORciones 4 yo por favor"
ham,"Dios mío, ¿cómo sabías lo que comí?"
spam,¡URGENTE! Este es el segundo intento de contactar a U! U Han ganado £ 1000call 09071512432 B4 300603T & CSBCM4235WC1N3XX.CALLCOST150PPMMOBILSVARY. Max £ 7. 50
ham,:( pero no estás aquí....
ham,No directamente detrás... abt 4 filas detrás de ü...
spam,Felicitaciones con 500 de cupones de CD o 125 Garantizado y entrada gratuita 2 100 wkly dibujan música txt a 87066
spam,"¿Tenía su contrato móvil 11 meses? Último Motorola, Nokia, etc. ¡Todo gratis! Doble mins y texto sobre tarifas naranjas. Mensaje de texto Sí para devolución de llamada, no para eliminar de los registros"
ham,No hay planes todavía. Qué estás haciendo?
ham,Hola.... mi compromiso ha sido arreglado en & lt;#& gt; TH del próximo mes. Sé que es realmente impactante bt... hmm njan vilikkam.... ts al de un sudn;-(.
ham,"Por supuesto que no. Solo matemáticas, un día, un capítulo y en un mes podemos terminar."
ham,"Wow no pensó que fuera tan común. ¡Lo llevo todo, no es un monstruo! A menos que lo cortes:-)"
ham,"Nooooooooo por favor. Lo último que necesito es el estrés. Por una vez en tu vida, sea justo."
spam,Tienes un admirador secreto que está buscando 2 contacto con U-Find Out Who They R*revela quién cree que eres tan especial en 09065171142-Stopsms-08718727870150ppm
ham,Veré si puedo pasar un rato. Primero tengo algunas cosas de las que ocuparme aquí.
ham,"Quería desearles un feliz año nuevo y quería hablar con usted sobre algunos consejos legales para hacer cuando Gary y yo nos separamos pero en persona. Haré un viaje a PTBO para eso. Espero que todo esté bien contigo, nena y te amo:)"
ham,¿No has terminado el trabajo todavía o algo así?
ham,"¡Correcto, no fuiste tú quien llamó por teléfono, era alguien con un número como el tuyo!"
ham,"Está bien, estoy enojado. Msg U Aft Vuelve a casa esta noche."
ham,Yo también lo pasé bien. Es bueno hacer algo un poco diferente con mis fines de semana para variar. Verte pronto
ham,"Lo siento, estaba en la ducha sup"
ham,"Carlos está abajo pero tengo que recogerlo de él, así que pasaré por un poco de USF"
ham,Calefacción completa PA:-) He aplicado petróleo PA.
ham,Estoy atrapado en la mitad de la fila en la mano derecha del lado de Da Lt...
ham,¿Ha puesto su línea Airtel para descansar?
ham,"Hola decidiste wot 2 conseguir 4 su cumpleaños, si no mal, probablemente consiga un cupón de virgen o sumfo"
spam,Mensaje gratuito: Txt: LLAME al número: 86888 y reclame su recompensa de 3 horas de tiempo de conversación para usar desde su teléfono ahora. Suscribirse6GBP/mes inc. 3 horas 16 paradas?txtStop
ham,"¡Hola J! ¿Te sientes mejor, Hopeso Hunny? ¡AMNOW SENTIR Y ITHINK PUEDE TENER TONSOLITUSASWELL! Maldito Iam Layin en Bedreal aburrido. LotsOf mev me xxxx"
ham,"Y no planeo quedarme la noche, pero probablemente no regrese hasta tarde"
ham,Gracias 4 puttin da fone sobre mí!
ham,"Necesito un octavo pero estoy fuera del campus, ¿podría recoger en una o dos horas?"
ham,"Oh... jaja... den, habíamos ido hoy también... gee, nvm la... kaiez, no me importa ir jazz oso... asustado hiphop abierto no puedo ponerse al día..."
ham,¡He estado funcionando pero solo se las arregló 5 minutos y luego necesitaba oxígeno! ¡Es posible que tenga que recurrir a la opción Roller!
ham,Vivimos en el próximo & lt;#& gt; mínimos
ham,Y de preguntar así.
ham,Me alegra estar hablando contigo.
ham,¿Qué hora ü termina?
ham,Lo siento papá. Me volví loca de tantos trabajos pendientes que hacer.
ham,Cuanto tienes para limpiar
ham,¿Cómo está mi persona favorita hoy? ¿Estás trabajando duro? no pude dormir de nuevo la última noche casi te llamó a las 4.30
spam,¡Sunshine cuestione! ¿Gana una grabadora de DVD de Super Sony si no puedes tocar la capital de Australia? Texto Mquiz a 82277. B
ham,Ü llamado papá oredi...
ham,Bien. ¿Crees que podrías enviarme algunas pix? Me encantaría ver tu superior e inferior...
ham,NVM... Voy a usar mis zapatos deportivos de todos modos... voy a llegar tarde leh.
ham,Este es un jodido showr
ham,"Recibido, entendido y actuó sobre!"
ham,Finalmente vinieron a arreglar el techo.
ham,"Necesitas mis presentes siempre porque no puedes amar. ""Jeevithathile Irulinae Neekunna Prakasamanu Sneham"" Prakasam Ennal Prabha 'que Mns Prabha Is'love' lo consiguió. No me maldigas..."
ham,Solo termina de soplarme el cabello. ¿Ya terminas la cena?
ham,Estoy en el autobús. Te amo
ham,Jajaja... lo sabía... lo vi en la tienda de dólar
spam,"Los números de Voda de hoy que terminan con 7634 se seleccionan para recibir una recompensa de £ 350. Si tiene una coincidencia, llame al 08712300220 citando el código de reclamación 7684 Aplicar tarifas estándar."
ham,"Solo las vacaciones del sábado y domingo, así que es muy difícil:)"
ham,Todos se divirtieron esta noche. Te extraño.
ham,"¿Tienes dinero de Hella Gas, ¿quieres hacer una gran aventura de la naturaleza con Galileo en un momento?"
ham,"Oh wow, eso es gay. ¿Actualizará el firmware Ayuda"
ham,Estos no servirán. Tengo que pasar a la morfina
ham,"¿Cómo es que yo c ü... sí, me corté el cabello..."
ham,K K Pa tuvo tu almuerzo Aha.
ham,El Capitán Vijaykanth está haciendo comedia en Captain TV... está borracho:)
ham,Por supuesto. Supongo que Dios me acaba de poner en espera ahora mismo.
ham,¿Te escondes de cualquier cosa o manteniendo la distancia de mí?
ham,No ha hecho.
spam,¡Estás siendo estafado! Obtenga su contenido móvil de www.clubmoby.com Llame al 08717509990 Poly/True/Pix/Ringtones/Games Six Descargas para solo 3
ham,"Lo siento, me bloqueé mi teclado."
ham,¿Estás planeando venir a Chennai?
spam,Intentamos comunicarnos con usted con su respuesta a nuestra oferta de un teléfono de video 750 en cualquier momento en que cualquier red mínea a mitad de precio de alquiler de alquiler de alquiler o llame al 08000930705
ham,"¡Dios creó la brecha por los dedos, por lo que Dat Sum1 Vry Special llenará esos vacíos sosteniendo sus manos... ahora, por favor, no le pregunte, creó tanto espacio entre las piernas!"
ham,Estamos bien. Me voy a dormir ahora. Más tarde
ham,"Finalmente ha sucedido..! Aftr décadas..! ¡La cerveza ahora es más barata que la gasolina! El gobierno espera que ""bebamos""... Pero no ""conduzcas"""
spam,¡Una recompensa de Navidad de £ 400 te está esperando! Nuestra computadora lo ha elegido al azar de nuestros clientes móviles leales para recibir una recompensa de £ 400. Solo llame al 09066380611
ham,¿Dónde se reunirá con TMR?
ham,Lol si. Pero agregará un poco de especias a su día.
ham,Nuestra madre de Prasanth Ettans falleció anoche. Solo ore por ella y su familia.
ham,"K, resolveré algo"
spam,¡PRIVADO! Su estado de cuenta de 2003 para muestra 800 puntos sin redimentación de S. I. M. Llame al 08718738002 Código de identificador: 48922 expira el 21/11/04
ham,Este mensaje es de un gran médico de la India:-): 1) No beba APPY FIZZ. Contiene cáncer que causa la edad.
ham,Lo llamas y le dices ahora frente a ellos. Llámalo ahora.
ham,"Ok, no hay problema..."
ham,Damas primero y género segundo k.
ham,"No. Sí, por favor. ¿He estado nadando?"
ham,Mamá no va a Robinson ya.
ham,Ok set déjate noe detalles más tarde...
ham,No... TEL Nombre del software..
ham,Envío las impresiones outs da.
ham,"Realmente soy soz imat, mi madre 2nite, ¿qué pasa con 2moro?"
ham,"Cuando nací, Dios dijo: ""¡Oh no! Otro idiota"". Cuando naciste, Dios dijo: ""¡Oh, no! Competencia"". ¡Quién sabía, un día estos dos se convertirán en Freinds para siempre!"
ham,"No recibí tu mensaje completo. Falta algún texto, envíalo de nuevo."
ham,"Probablemente no, estoy casi sin gasolina y tengo algo de efectivo mañana"
spam,"Anuncio de servicio al cliente. Recientemente tratamos de hacerle una entrega, pero no pudimos hacerlo, llame al 07099833605 para volver a programar. Ref: 9280114"
ham,Olvidé 2 preguntar ü todo smth.. Hay una tarjeta en el presente lei... ¿cómo? Ü Todos quieren 2 escribir SMTH o firmarlo?
ham,Me voy de casa ahora.
spam,"Hola nena es chloe, ¿cómo estás? Me rompí el sábado por la noche, ¡fue genial! ¿Cómo estuvo tu fin de semana? Me has estado extrañando? Sp visionsms.com Texto Detener para detener 150p/texto"
ham,Ü listo y luego llámame...
ham,Wewa es 130. Iriver 255. Todos los 128 MB.
ham,Es bueno que ahora esté obteniendo la conexión con BW
ham,Sry da..jst nw solo yo vengo a casa..
ham,"Eso es genial, estará aquí toda la noche, déjame saber cuándo estás cerca"
ham,¿Te quedas en la ciudad?
ham,"Jaja sí, 2 oz es una especie de mierda"
ham,"Ok, puedes llevarme de compras cuando te pagan = D"
ham,"Muy bien, te lo traeremos, nos vemos como & lt;#& gt; mínimos"
ham,Pero por favor no juegues en la vida de los demás.
ham,Come mi almuerzo...
ham,Hmmm. pero deberías darlo un día.
ham,"No lo intenté, G y yo decidimos no salir"
ham,"Ok, no hay problema"
ham,Surly te lo daré:-) mientras vendrá a revisar.
ham,"Al finalizar de marzo, debería estar listo. Pero te llamará seguro. El problema es que mi capital nunca se completa. Que tan lejos contigo. ¿Cómo está el trabajo y las damas?"
ham,"Tessy... por favor, hazme un favor. Por favor, transmítale mis deseos de cumpleaños a Nimya... Por favor, no lo olvide. Hoy es su cumpleaños Shijas."
ham,"Por favor, le dé la comida preferiblemente PAP muy lentamente con un montón de azúcar. Puedes tomar hasta una hora para darlo. Y luego un poco de agua. Muy muy lentamente."
spam,"¡URGENTE! ¡Su móvil no 07808726822 recibió un premio de llamadas de bsoloficación de £ 2,000 el 02/09/03! ¡Este es nuestro segundo intento de contactarlo! Llame al 0871-872-9758 Box95qu"
ham,Un tipo que se acostumbra pero es demasiado tonto para darse cuenta.
ham,"Okey Dokey, estaré en un poco solo solucionando algunas cosas."
ham,Si bien
ham,Me gustó el nuevo móvil
ham,En cualquier momento...
ham,Mmmmmmm* se acurruca en ti*...* suspiro contento profundo*...* susurros*... te amo tanto que apenas puedo soportarlo...
ham,"Sí, pero dicen que recibió algo de error."
ham,"Oye de todos modos, tengo que:-)"
ham,Wow tan saludable. Old Airport Rd Lor. No puedo decir nada más. Pero bañaré a mi perro más tarde.
ham,Wif mi paquete de tour de reserva familiar.
ham,"¿Dijiste audaz, luego antorcha más tarde? O una antorcha y 2 veces?"
ham,"Jaja increíble, podría necesitar llevarte a eso, ¿qué haces esta noche?"
ham,Yo te estoy dando vueltas... está bien gracias Kano... de todos modos disfruta con tu familia con el primer salario..:-);-)
ham,Huh tan lento que llego mucho tiempo liao... u 2 más días solo yo 4 más leh...
ham,¡Eso es genial princesa! Te cubriré la cara en semen pegajoso:)
ham,Big Brother realmente raspó el barril con esta lluvia de inadaptados sociales
ham,Ups i thk yo dun haf enuff... Voy a verificar y luego decirle a ü..
ham,S:) 8 min para ir a almorzar:)
ham,"Ey. ¿Qué pasó? A apague la celda D todo el día. Esto no es bueno. Ahora, si te importa, llámame mañana."
ham,"K hará, addie & amp; Estoy haciendo algo de arte, así que estaré aquí cuando llegues a casa"
ham,"Aiyo... su lección tan temprano... todavía me estoy durmiendo, jaja... okie, te vayas a casa liao den confirmar que me lor..."
ham,Olvidé decirle ü smth.. puede ü numerar las secciones para que sea más clara...
ham,"Sí. Cualquier cosa para, si no estás, está bien..."
ham,"Estoy en casa, mi amor... si todavía estás despierto... *amoroso beso *"
ham,¡Hola Peach! ¡Mi pastel sabía exuberante!
spam,"Juego gratis. Obtenga Rayman Golf 4 gratis desde el Arcade de los Juegos O2. Primero obtenga su configuración de juegos. Responder publicación, luego guardar y activ8. Presione la tecla 0 para Arcade. Términos aplicar"
ham,"Habrá una fiesta menor en mi casa más tarde esta noche, ¿te interesa?"
ham,Jason dice que es genial si recogemos un poco de su lugar en una hora como una hora
spam,"¿Tenías tu móvil hace 10 meses? Actualice a los últimos teléfonos con cámara/vídeo GRATIS. MANTENGA SU MISMO NÚMERO, obtenga minutos/textos adicionales gratis. Envía SÍ para una llamada"
ham,Yo (Carrera Tel) te he agregado como contacto en Indyarocks.com para enviar SMS gratis. Para eliminar de la agenda de la teléfonos - SMS no a & lt;#& gt;
ham,Ya he llegado.
ham,No sé preguntarle a mi hermano. Nada problemático algo que. Solo yo lo dije.
ham,K:) Eng Rocking en cenizas:)
ham,¿Qué hora r ü va al albergue de Xin?
ham,Buenos días mi querido Shijutta........... Que tengan un gran y amp; día exitoso.
ham,"Oh K:) Después de esa ubicación, ¿ah?"
ham,"No por posesión, especialmente no por primera infracción."
ham,"No solo para conducir, incluso por muchas razones, se la llama BBD... lo que lo es chikku, luego hw abt dvg frío... escucha la violencia de Vinobanagar, ¿es la condición... y HW ru? ¿Algún problema?"
ham,Ayer compré la prueba. Es algo que le permite saber el día exacto que ovule. Cuando obtendrá 2U en aproximadamente 2 a 3 semanas. Pero por favor no se preocupe. Sé que estás preocupado. Por favor relájate. ¿También hay algo en tu historia pasada que debes decirme?
ham,Tenemos pizza si quieres
ham,"Sigo viendo una mierda rara y estoy todos ""woah"" y luego me doy cuenta de que en realidad es razonable y soy todo ""oh"""
ham,Muchos más retornos felices del día. Te deseo feliz cumpleaños.
ham,Pensando en u;) x
ham,"Or, digo que ahora todavía cree."
ham,"Cuando acaba de poner en el signo +, elija mi número y el PIN se mostrará. ¿Bien?"
ham,La belleza de la vida está en el próximo segundo... que esconde miles de secretos. ¡¡Deseo que cada segundo en tu vida sea maravilloso...!! Dios n8
ham,"¡Gracias cariño! Soy genial, gracias. Unas copas de cumpleaños 2 noches. ¡Mañana libre! Cuídate pronto.xxx"
ham,"Si todavía está despierto, tal vez deje la tarjeta de crédito para que pueda obtener gasolina cuando regrese como él me dijo que"
spam,¡Sus tonos semanales semanales están listos para descargar! Los tonos nuevos de esta semana incluyen: 1) Axel de rana loco F >>> 2) Akon-Lonely >>> 3) Black Eyed-Dont p >>> Más información en n N
ham,"Bueno, muchacho, me alegro de la noche en la noche en Applebees por nada"
spam,Cashbin.co.uk (¡obtenga mucho efectivo este fin de semana!) Www.cashbin.co.uk Estimado bienvenido al fin de semana que tenemos nuestro mayor y mejor efectivo regalado! Estos..
ham,Ok para... o me has hecho ir a mirar 4 u?
ham,Ustedes 2 HAF Almuerzo Estoy en la cantina ahora.
ham,No hagas la vida demasiado estresante... siempre encuentre tiempo para reír. ¡Puede que no agregue años a tu vida! ¡Pero seguramente agrega más vida a tus años! GUD NI8..SWT Dreams..
ham,"Oye, parece que estaba equivocado y uno de los números de Kappa Guys todavía está en mi teléfono, si quieres, puedo enviarle un mensaje de texto y ver si está cerca"
spam,Gracias 4 Su apoyo continuo Su pregunta esta semana ingresará en UN2 nuestro sorteo 4 £ 100 en efectivo. ¿Nombra al nuevo presidente de los Estados Unidos? txt Ans a 80082
ham,Estoy en casa. Doc me dio dolor Meds dice que todo está bien.
ham,Es solo $ 140 ARD... É REST ALL ARD $ 180 al menos... que es el precio 4 é 2 bedrm ($ 900)
ham,¡Yo también! Que tengas una hermosa noche xxx
ham,Prepárate para ser complacido:)
ham,Hola.:) Soporte técnico. Proporcionando asistencia para nosotros Cliente a través de la llamada y el correo electrónico:)
ham,"Si envía mensajes de texto en su camino para detener, eso debería funcionar. Y eso debería ser autobús"
ham,¿Cuándo es tu programa de radio?
spam,"Su ID de usuario única es 1172. Para la eliminación, envíe una parada a 87239 Servicios al cliente 08708034412"
ham,Aunque no estoy seguro de si todavía está dispsoloble
ham,"¡Cualquiera que sea la relación que hayas construido en este mundo, lo único que al fin permanece es una soledad con muchos recuerdos! sentimiento.."
ham,"¡Salud Lou! Sí, fue una vergüenza de buenita, ¡¡¡¡¡¡¡¡¡¡¡¡¡¡¡¡¡¡¡¡¡¡¡¡¡¡¡¡¡¡¡¡¡¡¡¡¡¡¡¡¡. C Ya Gailxx"
ham,Hola... tengo el dinero da:)
ham,"Ok, entonces me dices lo que viene más tarde para."
ham,Repitas las instrucciones de nuevo. ¿Nombre de la carretera de Wat de tu casa?
ham,Bastante lor. Pero no diga que espere que se vuelva complaciente...
ham,"Lo siento, lo olvidó por completo * ¿Empicarán a los que se acercarán esta semana si todavía estás aquí?"
ham,"ERES LA CHICA MÁS HERMOSA QUE HE VISTO. Eres mi bebé, ven y ven a mí a la sala común."
ham,O No podemos ver si podemos unirnos a Denis y Mina? ¿O Denis quiere tiempo a solas?
ham,Sen dijo que se unirá a su tío Finance en CBE
ham,"Sí... oye, entonces, un día, en viernes podemos preguntarle a Miwa y Jiayin se retiran, vete karaoke"
ham,"Llámame, soy Senthil de HSBC."
ham,"Especialmente desde que hablo de Boston en mi declaración personal, ¡jajaja! ¡Cambiaría eso si me hubiera dado cuenta de que decía NYC! Dice Boston ahora."
ham,"De hecho, y por cierto era o no ambos!"
spam,"Urgente -Tall 09066649731 del teléfono fijo. Su feriado de gratuito 4* Ibiza o £ 10,000 en efectivo en efectivo Sae T & CS PO Box 434 SK3 8WP 150ppm 18+"
ham,"Santo Santo Viviente Cristo, ¿qué te está llevando tanto tiempo?"
ham,Ü thk de wat para comer esta noche.
ham,"Gracias. Sí, volvemos al sol. Termine la cena regresando 2 hotel ahora. El tiempo vuela, estamos toge 4 exactamente un MTH hoy. Espero que tengamos muchos más meses para venir..."
ham,Estamos en el lado opuesto de donde te dejamos.
ham,Sí. Izzit todavía lloviendo mucho porque estoy en E Mrt No puedo C afuera.
ham,Envíame tu currículum:-)
ham,GD Luck 4 tus exámenes:-)
ham,"O les preguntas a todos si el próximo sat puede no. Si todos pueden hacerlo, entonces estoy bien."
ham,"Lo siento, ese fue mi tío. I. mantendrá en contacto"
ham,Vi chicos y muñecas anoche con Patrick Swayze fue genial
spam,"Urgente, este es nuestro segundo intento de contactar a U. Su premio de £ 900 de ayer todavía está esperando la colección. Para reclamar llame ahora 09061702893"
spam,¡Santa Calling! ¿A tus pequeños les gustaría una llamada de Santa Xmas Eve? Llame al 09077818151 para reservar su tiempo. Llama 1.50ppm Últimos 3 minutos 30s T&C www.santacalling.com
ham,Ven a casa. No quiero que seas miserable
ham,No sé por qué ella no recibe tus mensajes
