tipo,mensaje
ham,Mi examen es para el 4 de febrero. Te deseo un gran día.
ham,"No sé qué hacer para salir de esto, así que solo estoy haciendo preguntas como esta, no me confundas."
ham,"Aight no apresurada, le preguntaré a Jay"
ham,Buenos días por favor llámame señor
ham,Está bien Lar. También duermes temprano... Nite...
ham,"Oh... icic... k lor, den se encuentra con otro día..."
ham,"Oh! Media hora es mucho más larga en Siria que en Canadá, ¿eh? ¡Vaya, debes hacer mucho más trabajo en un día que nosotros con todo ese tiempo extra! *Sonrido*"
ham,"A veces ponemos paredes alrededor de nuestros corazones, no solo para estar a salvo de ser lastimados... para descubrir quién le importa lo suficiente como para romper las paredes y el amp; Acércate.. Goodnoon:)"
ham,"Dulce, podemos ir o no a 4U para conocer a Carlos, por lo que medir el interés de Patty en eso"
ham,¿Entonces ella está comprando hoy? Ü no es necesario c meh...
ham,"Ah, lo siento, tardé diez años en ducharme. ¿Cuál es el plan?"
ham,Todos los lunes... la semana de la NXT vl estar completando..
ham,"Podría estar bien, estoy allí."
ham,"Simplemente enfríe para otras 6 horas. Si pudiera dormir, el dolor no es una emergencia quirúrgica, así que vea cómo se desarrolla. Bueno"
ham,"Sí, intentaré buscar algo"
ham,"Crazy ar, él está casado. Ü como GD mirando chicos, no yo. Mis frens dicen que es el favorito de Leona coreano, pero no estoy. A popa, pensando más en Mayb."
ham,Estaban en algún lugar de Fredericksburg
ham,Que pasea un buen tiempo o algo así
ham,¿Está bien si me quedo la noche aquí? Xavier tiene un saco de dormir y me estoy cansando
ham,Ella no necesita ninguna prueba.
ham,"Nada mucho, relajándome en casa. ¿Algún plan del Super Bowl?"
spam,"Free2day Sexy St George's Day Pic of Jordan! Txt Pic a 89080 No te lo pierdas, luego cada semana una celebridad descarada! 4 fotos más c Pocketbabe.co.uk 0870241182716 £ 3/wk"
ham,Bugis Oso cerca de Wat...
ham,No hay clase TMRW ¿verdad?
ham,Deja que tu corazón sea tu brújula tu mente tu mapa tu alma tu guía y nunca perderás en el mundo... gnun - enviado a través de way2sms.com
ham,"Buenas noches, duerme bien, por favor cuida pa. Por favor."
ham,Baaaaabe! ¡Te extraño! Dónde estás? Tengo que ir y enseñar mi clase a las 5...
ham,Usó convencerlo de que no es posible que duele su sentimiento es el principal
ham,"¡Buenas tardes amante! ¿Cómo va tu día? ¿Alguna suerte te ha llegado? Pienso en ti, cariño y envío mi amor a través del mar para hacerte sonreír y ser feliz."
ham,"Si empiezo a enviar Blackberry Torch a Nigeria, ¿me encontrarán un comprador? Como 4 al mes. Y dile a papá que no le compre bb a nadie oh."
ham,"& lt;#& gt; %de Pple se casan con sus amantes... porque tienen gud indirense que evita problemas. Envié a Dis 2 U, recibirás noticias de GUD el viernes por una persona que te gusta. Y mañana será el mejor día de tu vida. No rompas esta cadena. Si te rompes, sufrirás. Envía esto a & lt;#& gt; Frnds in & lt;#& gt; Mins Whn U LEAD..."
ham,"Tu amigo, adivina quién acaba de ser arrestado el otro día"
ham,Shuhui dice cambiar 2 suntec sambreboat? ¿No hay dónde? ¿Dónde estás ahora?
ham,¿Qué hace el río Dance?
ham,"Yetunde, lo siento, pero Moji y yo parecemos demasiado ocupados para poder ir de compras. ¿Puede encontrar alguna otra forma de obtener lo que quería que obtuviéramos? Por favor, perdóname. Puedes responder gratis a través de Yahoo Messenger."
ham,"Oye, seré muy tarde... ¿Quieres ir primero a la lección? Me uniré a ti. Solo estoy llegando a TP MRT"
spam,"Fantasías en vivo calientes Llame ahora 08707509020 solo 20p por minuto NTT Ltd, PO Box 1327 Croydon CR9 5WB 0870..K"
ham,BBQ esto se sentó en la mía de 6ish. Eres bienvenido 2 ven
ham,"No sé, lo mismo que está mal a menudo, el pánico comienza a salir de no ser lo suficientemente bueno..."
ham,"Está bien. Estoy dispsoloble, ¡he tenido una buena noche!"
ham,¿Intentaste hacer otro trasero?
ham,"Espero que te sientas bien. Por favor, lléname. Abiola"
ham,"Pensé que salimos y nos divierten, así que bar en la ciudad o algo así, ¿suena bien?"
ham,"1) Vaya a escribir msg 2) Poner en el modo de diccionario 3) Cubra la pantalla con la mano, 4) Presione & lt;#& gt;. 5) Eliminar suavemente tu mano.. es interesante..:)"
spam,"Bears Pic Nick, y Tom, Pete y... Dick. De hecho, todos los tipos intentan chat gay con la carga de fotos, llame al 08718730666 (10p/min). 2 mensajes de texto de parada llame al 08712460324"
spam,"500 nuevos móviles de 2004, ¡debe irse! Txt: Nokia to no: 89545 y recoge el tuyo hoy! De solo £ 1 www.4-tc.biz 2optout 087187262701.50gbp/mtmsg18 txtauction"
ham,Finalmente estamos listos para su información
ham,La tía Huai Juan nunca recoge su teléfono
spam,Doble mins y doble txt y 1/2 precio revelador en los últimos móviles de naranja Bluetooth. Llame a MobileUpd8 para obtener las últimas ofertas. 08000839402 o llamar2optout/LF56
ham,"Ya tel, wats tu problema.."
spam,No. 1 Nokia Tone 4 ¡Ur Mob cada semana! Solo txt nok a 87021. ¡1er tono gratis! Así que consigue a Txtin ahora y cuéntale a tus amigos. 150p/tono. 16 Respuesta HL 4info
ham,No tengo que tlk wid u
ham,"Pasamos nuestros días esperando que aparezca el camino ideal frente a nosotros... pero lo que olvidamos es... ""Los caminos se hacen caminando... no esperando..."" ¡Buenas noches!"
ham,"Está bien, mi brazo se siente débil porque tengo una oportunidad para que podamos ir otra vez"
ham,Reserve el boleto el sábado en la víspera de Chennai a Thirunelvali y nuevamente de Tirunelvali a Chennai la víspera del domingo... ya veo en la red... no hay boleto dispsoloble... quiero reservar el boleto a través de Tackle.
ham,"Mensor de asalto: ¿Qué levantas Phne, dices ""Hola""?... Es el nombre de una chica..!... Sí... ¿y tú, ¿quién es esa chica? ""Margaret Hello"" Ella es D GIRLFRND F GRAHMBELL que invnó Telphone....... Moraleja: Uno se puede 4get D Nombre de una persona, no es su chicafrnd... g o o d n i g h t...@"
ham,Está bien. Entré para preguntarle algo y me dijo que habías estado. ¿Estarás por aquí cuando venga esta chica?
ham,Todo el mejor 4 tu examen más tarde.
ham,¡Espero que tu cabeza no duele mucho 2! ¡Me estoy abriendo paso a través de una pila de planchado! Permanecer con un chinky esta noche ven si lo desea.
ham,Oh K. Creo que la mayoría de los jugadores de WI y NZ no venden.
ham,"Jaja... donde se puso tan rápido, perdió peso, thk muz va 4 al mes, la guarida tuvo efecto... Dios, más tarde vamos a poner el peso de Bk e."
ham,"Me pregunto cómo te pusiste en línea, mi amor. ¿Habías ido al café Net? ¿Recargaste tu teléfono? ¿Estabas en una red de amigos? Pienso en ti, boytoy"
ham,"Jaja solo broma, papá necesita drogas"
ham,"Thk shld b puede... ya, voy a ir 4 lecciones... jaja, puedo ir por un estiramiento completo..."
ham,"Ah, ok.."
ham,¿Siguemos reuniendo 4 cenas esta noche?
ham,¡Eso es genial! Soy un caballero y te trataré con dignidad y respeto.
ham,¿Comenzaré desde escuchar?
ham,Entonces esperamos 4 u lor... no necesito 2 sentirse mal...
ham,"No, ¿lo comprobaste? Recibí su mensaje detallado ahora"
ham,Has registrado a Sinco como beneficiario. Inicie sesión en ICICIBANK.com e ingrese Urn & lt;#& gt; para confirmar. Cuidado con los fraudes. No comparta ni revele URN a nadie.
ham,"No, decidí que solo las personas que se preocupan por las cosas votan y se preocupan por las cosas es para los perdedores"
ham,Kaiez... disfruta de tu matrícula... caramba... la segunda opción suena beta... iré yan jiu den msg u...
ham,Frío. ¡Nos divertiremos practicando a los bebés!
ham,"En realidad, preparándose para salir de la casa."
ham,K..K... ¿algún especial hoy?
spam,Información urgente e importante para el usuario de O2. ¡Hoy es tu día de suerte! 2 Descubra por qué iniciar sesión en http://www.urawinner.com hay una fantástica sorpresa en espera de ti
ham,Entonces tenemos que hacerlo después de eso
ham,"Tengo diez dólares, Jay no es compit"
ham,Donde también tenían hambre
ham,"Por favor, hable con ese machan del cliente."
ham,En algún lugar debajo de la luz de la luna pálida que alguien piense en ti en algún lugar donde los sueños se hacen realidad... Goodnite & amp; dulces sueños
spam,"Querido, has sido invitado a xchat. ¡Este es nuestro último intento de contactarte! Chat txt con 86688 150p/MSGRCVDHG/Suite342/2lands/Row/W1J6HL LDN 18 años"
ham,"Entonces, ¿tu opinión lo abt y cómo es el carácter?"
ham,Jay se riega y me dice que X está totalmente jodiendo los acordes mientras hablamos
ham,No... peleó horas antes.
ham,No es de extrañar... porque no estoy viendo un auto plateado... pero yo vi uno negro...
ham,Lmao. Tome una foto y envíela.
ham,Habla solo cuando sientas que tus palabras son mejores que el silencio... gud mrng:-)
ham,No. Ella está actualmente en Escocia por eso.
ham,¿Trabajas todo esta semana?
spam,Felicitaciones otorgaron £ 500 de cupones de regalo de CD y entrada gratuita 2 Nuestro sorteo semanal de £ 100 TXT Music a 87066 TNCS www.ldew.com 1 Win150ppmx3age16
ham,Lol genial ahora tengo hambre.
ham,Sí... ahora solo vi tu mensaje...
ham,Estaré en Mu en Like & lt;#& gt; artículos de segunda clase
ham,"¿Qué bien, gracias por los exámenes en marzo, no he hecho ninguna revisión? ¿Fran todavía está con Boyf? ¡Tengo que intervenir 4 Exeter Bit preocupado! X"
ham,"Te diga qué, si haces una pequeña hoja de cálculo y rastrea cuya idea era fumar para determinar quién ""fuma demasiado"" durante todo el mes de febrero, subiré"
spam,Para la venta - Arsenal Dartboard. ¡Buen estado pero sin dobles ni agudos!
ham,No mires hacia atrás en el edificio porque no tienes abrigo y no quiero que te enfermes más. ¡Date prisa en casa y usa un abrigo para el gimnasio!
ham,"Mi doloroso pensamiento personal: ""Siempre trato de mantener a todos felices todo el tiempo. Pero nadie me reconoce cuando estoy solo"""
ham,Gracias por cinco lindos deseos. Eres rockero
ham,Tu intrépido dúo tú! Diviértete y nos vemos a ambos pronto.
ham,Le pedí a Sen que viniera a Chennai y buscara trabajo.
ham,Papá salió oredi...
ham,¡Espero que sea cierto que me extrañe porque realmente lo extraño! Todavía no has hecho nada de lo que sentirte culpable.
ham,Wat tan tarde todavía temprano Mah. O nos vamos a cenar para 4 lor. Aiya no sé...
ham,"Brazos bien, ¿cómo están Cardiff y uni?"
ham,"De hecho, ¿cuándo te vas? Creo que Addie vuelve a la escuela el martes o el miércoles"
ham,"Breeze genial... Sol brillante... flor fresca... pájaros twitterantes... todos estos esperando para desearte: ""Buenos días y amp; Que tengas un buen día"":)"
ham,Ya:) para restaurante..
ham,"Está bien., Solo me pregunto, ¿no lo has hecho?"
spam,Entrada gratuita de la primera semana 2 TextPod 4 A Oportunidad 2 Gane 40GB iPod o £ 250 en efectivo cada semana. Txt Pod a 84128 TS y CS www.textpod.net custcare 08712405020.
ham,Esas chinchillas ducking
ham,Estoy en una función de matrimsoloo
ham,"Parece que lo hiciste un avance, me voy de aquí 2.30ish, pero si estás desesperado por mi compañía en la que podría ir antes, nos reunimos en Rummer."
ham,No das un mono volador que piensan y ciertamente no me importa. ¡Cualquier amigo mío y todo eso!
spam,"Como suscriptor de optina registrado, Ur Draw 4 £ 100, se ingresará al recibir una ANS correcta a 80062, ¿qué no 1 en las listas de BBC?"
ham,Di gracias2.
ham,Msg me cuando viene Rajini.
ham,¡ ¿Cuándo está tomando lecciones prácticas? Empiezo en junio..
ham,"Eso es bueno, porque necesito drogas"
ham,Estúpido no es posible
ham,¿Pueden ü decidir más rápido porque mi hermana se va a casa liao..
spam,"Veranos finalmente aquí! ¿Te apetece una charla o coquetea con solteros sexys en el área de su? Para emparejarse, solo responda el verano ahora. GRATIS 2 unirse. OPTOUT TXT STOP AYUD08714742804"
ham,¿Estás durmiendo ahora... o vas a tomar? Jaja.. tengo spy wat.. yo en línea revisando y respondiendo correos para..
spam,"CLAIRE, aquí estoy pasando un rato aburrido y ahora estoy sola. ¿Quieres correrte durante una segunda noche? Chatear ahora 09099725823 esperanza 2 C U Luv CLAIRE xx Llamadas£1/minmoremobsEMSPOBox45PO139WA"
spam,"Compró un tono de llamada y ahora recibe textos que cuestan 3 libras ofreciendo más tonos, etc."
ham,"Yalru lyfu astne chikku.. bt innu Mundhe lyf ali halla ke bilo (matrimsoloo) Programa Edhae, por lo que lyf es nt aún ovr chikku..ali vargu lyfu meow: -d"
ham,Un poco. ¡Primero entra a las doce! Aah. Hablar tomo
spam,"09066362231 urgente! ¡Su móvil no 07XXXXXXXXX ganó un premio de llamadas de bsoloficación de £ 2,000 el 02/06/03! ¡Este es el segundo intento de comunicarse con usted! ¡Llame al 09066362231 lo antes posible!"
ham,"Está bien, entonces más tarde vengo a buscar ü... C afortunado, le dije a ü que fuera antes... más tarde, pple, termine ü no más..."
ham,"Lo que te hace caer. Pero en realidad, soy bastante propenso 2 caídas. Por suerte mi papá en casa, le pido que ven a buscarme."
spam,"¡Usted 07801543489 tiene garantizado las últimas que nokia Teléfono, un reproductor de MP3 de 40 GB o un premio de £ 500! Palabra txt: recopilar al no: 83355! TC-LLC NY-USA 150P/MT MSGRCVD18+"
ham,No te tocaré sin tu permiso.
spam,"Hola, su esposo Lucy en Meetins todo el día, Fri y estaré solo en el hotel, te parecen comino. Por favor, deje el mensaje 2day 09099726395 Lucy X llamadas £ 1/minmobsmorelkpobox177hp51fl"
ham,"7 maravillas en mi mundo séptimo lugar sexto tu estilo 5 ° Ur Smile 4th Ur Personality 3rd Ur Nature 2nd Ur SMS y 1 ° ""Ur encantadora amistad""... Buenos días querido"
ham,Tome un poco de tableta de dosis pequeña para fiebre
ham,Oh. Debes haber llevado tu verdadero San Valentín de compras primero.
ham,"Acabo de enviarle un correo electrónico, a una dirección con Incomm en él, ¿es cierto?"
ham,"¿Lo haré, estarás en Blake's toda la noche? Podría salir de aquí un poco temprano"
ham,"La amistad no es un juego para jugar, no es una palabra para decir, no comienza en marzo y termina en mayo, es mañana, ayer, hoy y e"
ham,"Lindo. Espera... ¿deberías enviar mensajes de texto ahora mismo? No voy a pagar tu boleto, ¡ya sabes!"
ham,"Estoy viendo a Lotr con mi hermana después. Entonces, ¿te conocen 4 cena en la noche? ¿No?"
ham,¿Por qué me mantienes alejado así?
ham,"Creo que es mucho más que eso, pero averigüe. Consulte Google Maps para un lugar de su dormitorio."
ham,"Mi viaje estaba bien pero bastante agotador. Uni comienza hoy, pero está bien."
ham,¿Siempre has estado diciendo Welp?
ham,"Soy un chico, la navegación es obligatoria"
ham,La pureza de la amistad entre dos no se trata de sonreír después de leer el mensaje reenviado... se trata de sonreír con solo ver el nombre. Gud evng Musthu
ham,"(Debo agregar que realmente no me importa y si no puedes, al menos puedo hacer que este tipo se vaya a la mierda, pero bueno, tu dinero si lo quieres)"
ham,"¡Hola amante! ¿Cómo va ese nuevo trabajo? ¿Estás ahí ahora? ¿Estás feliz? ¿Piensas en mí? Me despierto, mi esclavo y te envío un beso burlón desde el otro lado del mar"
ham,Le dije tu número a Gautham..
ham,Dígales que no hay necesidad de investigar sobre mí en ningún lado.
ham,"Ok, ya lo recibo.."
ham,"No puedo creer que te dije tantas cosas esta mañana cuando todo lo que realmente quería decir fue buenos días, ¡te amo! Que tengas una hermosa mañana. Nos vemos en la biblioteca más tarde."
spam,"Su cuenta ha sido acreditada con 500 mensajes de texto gratuitos. Para activar, solo txt la palabra: crédito al no: 80488 t & cs www.80488.biz"
ham,"Al final, ella aún podría vomitar pero está bien. No todo saldrá."
ham,¿Cómo estás con dinero... como para ti... el dinero no es una cosa... ¡cómo estás Sha!
ham,Tiene todo que ver con el clima. Mantenga más caliente. Es un frío pero nada grave. Por favor mucha vitamina C
ham,Hola chicas. ¿Alguien de ustedes irá al centro de conducción tmr?
ham,Siempre estoy en Yahoo Messenger ahora. Simplemente envíe el mensaje y yo. Y responderá.
ham,Lo estoy psoloendo ahora. Debe estar listo para & lt; Time & gt;
ham,"Tiempo y sonreír las dos cosas cruciales en nuestra vida. A veces el tiempo nos hace olvidar la sonrisa, y a veces la sonrisa de alguien nos hace olvidar el tiempo Gud Noon"
spam,"SMS. ac JSco: La energía es alta, pero es posible que no sepas dónde canalizarla. 2 días Tus habilidades de liderazgo son fuertes. ¿Psíquico? Responda ANS con pregunta. ¿Fin? Responder FINALIZAR JSCO"
ham,IDPS basados ​​en host para sistemas Linux.
spam,"HOT LIVE FANTASIES llame ahora al 08707509020 Solo 20 peniques por minuto NTT Ltd, PO Box 1327 Croydon CR9 5WB 0870 es una llamada con tarifa nacional"
ham,No Don Da:) ¿Qué planeas?
ham,Estaré allí el <#> ok.
ham,Ay dios mío. Estoy casi en casa
ham,"Descarga gratuita de Total Video Converter, escribe esto en la búsqueda de Google:)"
spam,"Gracias por la votación. Ahora canta junto con las estrellas con karaoke en tu móvil. Para un enlace gratuito, solo responda con Sing Now."
ham,Suena como algo que alguien que me está probando diría
ham,"Cuando amas a alguien, no hagas que te amen tanto como tú. Pero los amo tanto que no quieren ser amados por nadie excepto tú... Gud nit."
ham,"Pete, ¿es este su teléfono todavía? Es Jenny de la universidad y Leanne. ¿Qué estás haciendo ahora?:)"
ham,Ups lo siento. Solo para comprobar que no te importa recogerme a Tomo a la mitad de las ocho de la estación. ¿Estaría bien?
ham,"Oye, dulce, me preguntaba cuándo tuviste un momento si vienes a mí. Quiero enviar un archivo a alguien, pero no pasará a Yahoo para ellos porque su conexión apesta, ¿recuerdas cuando configuras esa página para que yo vaya y descargue el disco de formato? ¿Podrías decirme cómo hacer eso? ¿O conoces alguna otra forma de descargar archivos grandes? Porque pueden descargar cosas directamente desde Internet. Cualquier ayuda sería genial, mi presa... *burlándose del beso *"
ham,¿Cómo está el campeón dejando Glasgow!
ham,K:)todo lo mejor:)felicidades...
ham,Me pregunto si recibirás este texto.
ham,Necesito volver a casa y darte un buen amor...
spam,Nuestro nuevo servicio de música móvil ahora está en vivo. El reproductor de música gratis llegará en breve. Simplemente instale en su teléfono para explorar contenido de los mejores artistas.
ham,¿Debo preguntar una cosa si no me confundes?
ham,"Verifique el speling de Corect Corect, es decir, el sarcasmo"
spam,"¡URGENTE! ¡Su móvil no recibió un premio de llamadas de bsoloficación de £ 2,000 el 1/08/03! ¡Este es nuestro segundo intento de contactarlo! Llame al 0871-4719-523 Box95qu BT Tasa nacional"
ham,Estás enojado conmigo. Que pasa querido
ham,Yo dun hav 2 indin en el foro ya para... porque le dije que Ron N Darren va 2 decirle a Shuhui.
ham,"Sí, ok gracias..."
ham,Hola:) Empleado de CTS ¿Cómo estás?
ham,"Por favor, averigüe a la tía Nike."
ham,"Wow... te amo mucho, ¿sabes? ¡Apenas puedo soportarlo! Me pregunto cómo va tu día y si estás bien, mi amor... pienso en ti y te extraño"
ham,No gritar significa gritar..
ham,"Oye, ¿qué pasa? ¿Estás bien?"
ham,¿Debería haber recogido un recibo o algo antes?
ham,¿Creo que Chennai se estableció bien?
ham,¡Dios mío! ¡No quise enviarte eso! ¡Jajaja!
ham,"Desafortunadamente, acabo de descubrir que tenemos que recoger a mi hermana del aeropuerto esa noche, así que no creo que saldré en absoluto. Deberíamos intentar salir uno de los"
ham,Novio horrible... Ahora tengo hambre...
ham,Recuerda ese día..
spam,"Has ganado un Nokia 7250i. Esto es lo que obtienes cuando ganas nuestra subasta gratuita. Para participar, envíe a Nokia al 86021 ahora. HG/Suite342/2lands Row/W1JHL 16+"
ham,"¿Cómo se siente? Sr. No es mi verdadero San Valentín solo mi San Valentín, ¡¡¡¡¡¡¡¡¡¡¡¡¡¡¡¡¡¡¡¡¡¡¡¡¡¡¡¡¡¡¡¡¡¡¡¡¡¡¡¡¡¡¡¡¡¡¡¡¡.egan."
ham,Todo suena bien. Dedos. Hace que sea difícil escribir
ham,Medianoche lo antes posible
ham,¿No estás seguro de que no estoy tratando de hacer que Xavier sea humo porque no quiero fumar después de que me digan que fumo demasiado?
ham,K ven a nordstrom cuando hayas terminado
ham,¿Konw waht es Rael Friendship im gving yuo an Exmpel? Que tengas un buen sueño... Sweet Dreams..
ham,Ahora conferencia de prensa da:)
spam,"Hola de naranja. Para el acceso gratuito de 1 mes a juegos, noticias y deporte, más 10 textos gratuitos y 20 mensajes fotográficos, responda sí. Se aplican términos: www.orange.co.uk/ow"
ham,Después de un grado completado. No sirve de nada para unirse a las finanzas.
ham,"¡Buenas tardes, mi amor! ¿Alguna perspectiva laboral? ¿Me estás extrañando? A qué te dedicas? ¿Estás siendo perezoso y sombrío, hmmm? ¿O feliz y lleno de mi amor?"
ham,Shant molestarte más... jia tú...
ham,Bishan Lar más cerca... No es necesario comprar tan temprano porque si compra ahora tengo que estacionar mi auto...
ham,"Yo, no lo sé de nuevo oh"
ham,Amigo Sux para Snake. Se hizo viejo y Raiden se aferra
ham,Él dice hola y para que regrese al sur de Tampa (preferiblemente en un kegger)
ham,En E Msg jus ahora. Dijiste gracias por el regalo.
ham,Tú también...
ham,"Bueno, ¿cómo estás? llamaste a chechi"
ham,"Sí, hacemos bolsas. ¿Cuándo quieres?"
ham,"Ok, encontré a Dis Pierre Cardin uno que parece costo normal 20 está a la venta."
ham,El buen sueño se trata de ritmo. La persona tiene que establecer un ritmo que el cuerpo aprenderá y usará. Si quieres saber más:-)
ham,¿Qué estás haciendo?
ham,Mensaje de. Estoy en el Hospital Truro en ext. Puedes llamarme aquí. Como tengo un teléfono a mi lado
ham,"Línea única con un gran significado::::: ""Se pierda cualquier cosa 4 tu"" mejor vida ""pero no te pierdas tu mejor vida por nada... gud nyt..."
ham,"¿Acabo de obtener algo de dinero de gas, ¿alguna posibilidad de que usted y la pandilla quieran hacer una gran aventura de la naturaleza?"
ham,No se preocupe... Use piezas de hielo en un paquete de tela. También tome 2 tabletas.
ham,Dude acaba de ver un auto estacionado con su techo solar apareciendo. Sux
ham,Prepárese para ponerse su excelente Sub Face:)
ham,TMRW. Estoy terminando 9 puertas
ham,"El & lt;#& gt; G que vi hace unos días, el chico quiere vender csolo solo para & lt;#& gt; y con 3g para & lt;#& gt;. Por eso lo en blanco."
ham,Llego tarde. Estaré allí en
ham,"Lo que sea, estoy bastante enojado."
ham,No tengo tanta imagen en clase.
ham,No:-) Tengo rumor de que vas a comprar apartamento en Chennai:-)
ham,Cerca de la oficina de televisión de kalainar.thenampet
spam,"Su saldo de efectivo es actualmente de 500 libras; para maximizar su ingreso de efectivo, envíe GO al 86688 solo 150 peniques/mensaje. CC 08718720201 HG/Suite342/2Fila de tierras/W1J6HL"
spam,Subasta de SMS: ¡una nueva subasta Nokia 7250 está arriba 4 de la subasta hoy! ¡La subasta es gratuita 2 ¡Únete y participa! Txt nokia a 86021 ahora! HG/Suite342/2lands Row/W1J6HL
ham,"Mi hermana está atrapando E Show en la tarde, así que no lo estoy viendo. Así que c u wan 2 watch hoy o tmr lor."
ham,"Suena GD... jaja... puede... wah, yan jiu tan rápido liao..."
ham,"No. Supongo que para ser entrometido. ¿No sé, estoy reaccionando demasiado si estoy asustado?"
ham,"Recuerda a todos aquellos a quienes lastimé durante los días de impostor satánico en mí. Necesitan pagar un precio, que así sea. Mientras el destino me mantiene en marcha y, mientras dijiste, reza para que la mente deba superar lo mismo."
ham,¿Cómo hacer feliz a una chica? No es nada difícil hacer felices a las chicas. Solo necesitas ser... 1. Un amigo 2. Compañero 3. Amante 4. Chef... & lt;#& gt;. Buen oyente & lt;#& gt;. Organizador & lt;#& gt;. Buen novio & lt;#& gt;. Muy limpio y lt;#& gt;. Simpatizo & lt;#& gt;. Athletic & lt;#& gt;. Cálido... & lt;#& gt;. Valiente & lt;#& gt;. Determinado & lt;#& gt;. Verdadero & lt;#& gt;. Confiable & lt;#& gt;. Inteligente... & lt;#& gt;. Psicólogo & lt;#& gt;. Pest Exterminator & lt;#& gt;. Psychiatrist & lt;#& gt;. Sanador.. & lt;#& gt;. Estilista & lt;#& gt;. Conductor.. Aaniye Pudunga Venaam..
ham,"¿Por qué es eso, princesa? ¡Apuesto a que los burdas te están persiguiendo!"
ham,"Reservaré Chez Jules para la mitad de las ocho, si eso está bien para ti."
ham,Hhahhahahah Rofl wtf nig era Leonardo en tu habitación o algo así
ham,"Sí, en la casa de Derek ahora, nos vemos el domingo y lt; 3"
ham,"Es genial, avíseme antes de que comience alrededor de & lt;#& gt;, Estaré fuera y todo el día"
ham,"Me preguntaba si estaría bien que llames al tío John y le hiciera saber que las cosas no son las mismas en Nigeria, ya que están aquí. Que & lt;#& gt; Los dólares son 2 años enviados y que sabes que es una tensión, pero planeo pagar cada centavo que da. Cada diez centavos, así que para mí esperar nada de ti, no es práctico. Algo así."
ham,No hay otros cargos después de los cargos de transferencia y puede retirarse de todos modos que le guste
ham,"No busques el amor, deja que el amor te encuentre. Por eso se llama enamorarte, porque no te obligas a ti mismo, solo te caes y sabes que hay que hacerte... bslvyl"
ham,A las 4. Vamos a Bill Millers
ham,Te amo. Pusiste mi alma en llamas. No es solo una chispa. Pero es una llama. Una gran llama de cruda. Xoxo
ham,"Somewhr alguien seguramente está hecho 4 u. Y Dios ha decidido un momento perfecto para hacerte conocer a esa persona.... hasta den,..... Disfruta tus enamoramientos...!!!;-)"
ham,Ese es mi atuendo de luna de miel.:)
ham,¿Ayudará si proponemos volver mañana
spam,¡PRIVADO! Su estado de cuenta de 2003 para muestra 800 puntos sin redimentación de S. I. M. Llame al 087198999230 Código de identificador: 41685 expira el 07/11/04
