tipo,mensaje
ham,"Estoy pensando en ir a Reg para las clases de prácticas... arrojó mi avance... jaja, ¿qué hora te va?"
ham,Fresco. Soy <#> pulgadas de largo. Espero que os gusten en grande!
ham,"House-Maid es el asesino, porque el hombre fue asesinado en & lt;#& gt; TH ENERO.. Como feriado público, todas las instituciones del gobierno están cerradas, incluida la oficina de correos..."
ham,Okie.. gracias..
ham,Ir a donde n compre? Juz compra cuando llegamos allí.
ham,Estoy trabajando soporte técnico:) Proceso de voz.
ham,¡Es solo una semana de una semana desde que rompimos y ya nuestros cerebros van a papilla!
ham,"Tunde, ¿cómo estás? Esto solo te desea un gran día. Abiola."
ham,No... c ü entonces...
ham,No. Pero haremos misiones médicas a Nigeria
ham,"No, no tengo ninguna película en mi computadora portátil"
spam,"Urgente, llame al 09066612661 desde el teléfono fijo. £ 5000 en efectivo o una colección de vacaciones de lujo 4* de las Islas Canarias. Premio T & CS SAE. 20m12aq. 150ppm. 16+ """
spam,"¡Urgente! Llame al 09066612661 desde su teléfono fijo, su festividad de complemento 4* Lux Costa del Sol o colección de £ 1000 en efectivo. PPM 150 SAE T & CS JAMES 28, EH74RR"
ham,No he hecho lei.. ¿el próximo lunes puede?
ham,Mm sintiéndome somnoliento. Hoy mismo obtendré eso querido
ham,¿Cómo te atreves estúpido? No te diré nada. Escuche después de no hablar contigo:-.
ham,¿Ü noe si Ben va?
ham,¿Puedes hacer una revista para conocer este avo en algún momento?
ham,¿Me refería a la mitad o la derecha?
ham,¿En realidad? Me estreché acurrucado en mi sofá.
ham,Hola chachi intenté llamarte ahora incapaz de comunicarse
ham,"Te envié los precios y te refieres al & lt;#& gt; gramo,"
ham,Nada. Poder...
spam,No te conozco y no me conoces. Manda CHAT al 86688 ya y ¡busquémonos! Sólo 150p/mensaje grabado. HG/Suite342/2Terrenos/Fila/W1J6HL LDN. 18 años o más.
ham,"No * estoy trabajando en la cosa de tu rumi, pero tengo una casa llena de mocosos gritando, así que * me estoy sacando el pelo! Amarte"
ham,"Pero mi familia no responde por nada. Ahora estoy en la habitación, no fui a casa para Diwali, pero nadie me llamó y por qué no venir. Me hace sentir que murió."
ham,"Tick, tick, tick... nena"
ham,R ü yendo 4 la reunión de hoy?
ham,K da:) ¿cuántas páginas quieres?
ham,Ya tenían ahora ahora.
ham,"Envíe su número y responda mañana por la mañana por qué le dijiste eso así, ok"
ham,Dijiste que no ahora. Ningún problema. Cuando puedas. Hágamelo saber.
ham,"Ok, pero dime la mitad de HR B4, ven, necesito 2 Preparar."
ham,¿Jugar W Computer? Aiyah i tok 2 u lor?
ham,Sentado ¿verdad? Bien gracias...
ham,"Derp. Lo cual es peor, un tipo que siempre quiere fiesta o un tipo que presenta una queja sobre los tres abusadores de drogas con los que vive"
ham,"Ok, comida china en su camino. Cuando estoy gordo, estás pagando por mi lipo."
ham,Ya estamos afuera.
ham,"Que tengas un buen viaje. Cuidado. Recuerde que cuando regrese, debemos decidir sobre Pascua."
ham,Yo estamos viendo una película en Netflix
ham,A qué hora. Estoy fuera hasta el problema 3 más o menos
ham,"¿Meh? Los que algunos chocarán... realmente ah, no me importa... no he visto haber perdido peso... caramba..."
ham,"No lo sé, es una llamada incorrecta entre nosotros"
ham,ARR Cumpleaños hoy:) Deseo que obtenga más Oscar.
ham,"Abra Rebtel con Firefox. Cuando se carga, simplemente coloque más firmado en el lugar de nombre de usuario, y le mostrará dos números. El número más bajo es mi número. Una vez que elija ese número, ¡el PIN se mostrará bien!"
ham,Y recogiéndolos desde varios puntos
spam,¡Las mujeres locales casadas buscan una acción discreta ahora! 5 coincidencias reales instantáneamente a tu teléfono. Match de texto al 69969 Costo de MSG 150p 2 Stop txt Stop BCMSFWC1N3XX
ham,Wow v v impresionado. ¡Diviértete de compras!
ham,Estoy en camino a tu casa
spam,Burger King: ¿Quieres jugar al fútbol en un estadio de primer nivel? Consigue 2 Burger King antes del 1 de septiembre y elige Grande o Súper con Coca-Cola y sal como ganador
ham,Ningún problema. Hablaré contigo más tarde
ham,"Entonces tu hermana, ¿cómo?"
ham,Todavía en el lugar del cliente
spam,¿Cómo es que le toma tan poco tiempo a un niño que tiene miedo de que la oscuridad se convierta en un adolescente que quiere quedarse fuera toda la noche?
ham,"Amigo u knw también telugu..thts gud..k, gud nyt.."
ham,¿Confirma comer en Esplanade?
ham,Envíame tu identificación y contraseña
ham,Un poco. Lo llevó al garaje. La parte central del escape necesita reemplazar. Parte ordenó que lo tomara para ser arreglado por la mañana.
spam,"Para su oportunidad de ganar un efectivo de £ 250 cada wk txt: acción a 80608. Www.movietrivia.tv custcare 08712405022, 1x150p/wk."
ham,"Bueno, podría no venir entonces..."
ham,Mucho después de dejar de fumar. Me llevo solo como 5 minutos al día como está.
ham,"Entonces es muy probable que se llame Mittelschmertz. Google. Si no tiene paracetamol, no se preocupe, se irá."
ham,"Bueno, en este bien, tendré que levantarme y verificar las ventas de Steam de hoy/orinar, así que envíeme un mensaje de texto cuando quieras que venga a buscarte"
ham,"Recién llegado, nos vemos en un par de días <3"
ham,"K, ¿qué incidente?"
ham,"Sí, consigue el ilimitado"
ham,Cthen i thk shd b enuff.. todavía obtuve conclusión n contenido pg n referencias... haré da da contenidos pg n cubre pg..
ham,"Olvidé que me lleva 3 años ducharme, lo siento. ¿Dónde estás muerto/tu teléfono muerto?"
ham,"Si tienes algo que comprar, dínoslo y no es necesario que vuelvas a venir."
ham,Cuando eres grande.. | Dios traerá éxito.
spam,Has otorgado £ 50 para jugar 4 efectivo instantáneo. Llame al 08715203028 para reclamar. Cada noveno jugador gana min £ 50- £ 500. Optout 08718727870
ham,"... Nos quedamos aquí una semana extra, de regreso el próximo miércoles. ¿Cómo lo hicimos en el rugby este fin de semana? Hola a y, y pronto """
ham,"Bueno, todavía queda un poco si ustedes quieren esta noche"
ham,No de este campus. ¿Estás en la biblioteca?
ham,"La declaración jurada dice & lt;#& gt; E Twiggs St, División G, Correos y lt;#& gt;, & lt; Time & gt; SOY. Te verificaré dos veces y te enviaré un mensaje de texto de nuevo mañana"
ham,¿Cómo te arrastraré ahora?; _;
ham,"Si llego ante usted después de sus diez mil millones de llamadas y mensajes de texto, así que ayúdame Dios"
ham,Le he dicho que lo he devuelto. Eso debería volver a pedirlo.
ham,"House-Maid es el asesino, porque el hombre fue asesinado en & lt;#& gt; TH enero.. Como feriado público, todas las instituciones gubernamentales están cerradas, incluida la oficina de correos."
ham,Depende de a dónde vayas.
ham,Y sonríe para mí ahora mismo mientras vas y el mundo se preguntará por qué estás sonriendo y piensas que estás loco y mantente alejado de ti... *sonríe *
spam,Freemsg> fav tonos de Navidad! Responder real
ham,Lil Fever:) ahora bien:)
ham,Creo que todo todavía está en mi coche
ham,¿Puede un no?
ham,"¡Sí, princesa! Quiero atraparte con mis grandes manos fuertes..."
ham,"Ah, sí, lo olvidé. Solo puedes llevar 2 a comprar a la vez."
ham,Mm Entonces me pidiste que no llamara a la radio
ham,Pensar en alguien está bien. No hay drogas para eso
ham,"Disfrute de las duchas de posesividad vertidas sobre usted por sus seres queridos, porque en este mundo de mentiras, es un regalo de oro ser amado de verdad..."
ham,"Muy bien si estás seguro, avísame cuando te vayas"
ham,Algunos duran hasta 2 horas. Puede que tengas suerte.
ham,Genio que pasa. Cómo tu hermano. Por favor envíe su número a mi Skype.
spam,"Gr8 Poly tonos 4 TODOS los mobs dirigen 2u rply con POLY TITLE a 8007, por ejemplo, POLY BREATHE1 Títulos: CRAZYIN, SLEEPINGWITH, FINEST, YMCA:getzed.co.uk POBox365O4W45WQ 300p"
ham,Los que algunos de ellos encuentran lo que se encuentran demasiado lejos... no vaya...
ham,No olvides quién te posee y quién es la propiedad privada que eres... y seas mi buen chico siempre... *beso apasionado *
spam,Interflora: no es demasiado tarde para ordenar flores de interflora para navidad llame al 0800 505060 para hacer su pedido antes de la medianoche de mañana.
ham,Oh dios... ¿los dientes? ¿Está doliendo?
spam,"RomCapspam todos los que están alrededor deberían responder bien a su presencia, ya que usted es muy cálido y extrovertido. Estás trayendo un aliento real de sol."
ham,Entonces le preguntas a Darren Go N Pick U Lor... pero yo Oso Sian Tmr Haf 2 Meet Lect...
ham,No es necesario comprarme el almuerzo.. como Maggi Mee..
spam,"Felicitaciones: gracias a un buen amigo que has ganado el premio de Navidad de £ 2,000. 2 Reclamo es fácil, ¡solo llame al 08712103738 ahora! Solo 10p por minuto. Bt-National Tel"
ham,"Ah, claro, está bien. ¡Me aseguraré de trabajar mucho durante el día! Tuve una tos muy desagradable hoy y está seco y listo, ¡así que eso debería ayudar mucho!"
ham,Esposa. ¿Cómo supo exactamente la hora del asesinato?
spam,Envíe un logotipo 2 Ur Lover - 2 nombres unidos por un corazón. Nombre de amor txt1 Nombre2 Mobno EG ADAM EVE 07123456789 A 87077 Yahoo! POBOX36504W45WQ TXTNO 4 No ADS 150p.
ham,Gracias 4 enviándome a casa...
ham,Su correo normalmente caliente. ¡COMES VEY!
spam,"Has ganado TKT a la final de la Copa Euro2004 o en efectivo de £ 800, para cobrar llame al 09058099801 B4190604, POBOX 7876150ppm"
ham,¿Estás enfermo todavía puede ir de compras?
ham,"Sí, están muy bien. BBD (pooja) tiene granos llenos... incluso ella se vuelve bastante negra... y tu rito aquí hace demasiado frío, usa un suéter..."
ham,Bsoloto.nice. ¿Cómo está funcionando?
ham,Llámame a casa.
ham,Intentaban encontrar un lugar de comida china por aquí
ham,"Easy amigo, * supongo que la bebida rápida era un poco ambiciosa."
ham,Nena!!! I miiiiiiiiissssssssss! Te necesito!!! Te anhelo!!!:-(... Geeee... estoy tan triste sin ti nena... te amo...
ham,Ok gracias...
ham,"Tunji, ¿cómo está la reina? Cómo estás. Esto solo te desea un gran día. Abiola."
ham,"Hoy iZ Día de la rosa amarilla. Si amas a mi amistad, dame 1 llamada errónea y más. envía esto a ur frndZ & Mira cuántas llamadas perdidas recibes. Si te pierden 6, te casas con tu amante."
ham,Estará fuera de clase en unas pocas horas. Lo siento
ham,¿Qué tiempo terminaste tu lectura hoy?
spam,"Messaje libre: ¡Jamster! ¡Obtén el ssolodo loco de la rana ahora! Para Poly Text Mad1, para texto real Mad2 a 88888. ¡6 ssolodos locos por solo 3 GBP/semana! ¡16+solo! Aplicar T&C"
spam,"SU OPORTUNIDAD DE ESTAR EN UN REALITY FANTASY SHOW llame ahora = 08707509020 Solo 20 peniques por minuto NTT Ltd, PO Box 1327 Croydon CR9 5WB 0870 es una llamada nacional = tarifa"
ham,Ella está bien. Es bueno saber de ti. ¿Cómo estás querida? Feliz año nuevo oh.
ham,¿Vas a la entrevista de Wipro hoy?
ham,Cuanto mides princesa?
ham,Dudo que puedas manejar 5 veces por noche en cualquier caso...
ham,Jaja... Espero que ü pueda escuchar el ssolodo del recibo... ¡GD suerte!
ham,Vas a ser la muerte si yo. Dejaré una nota que diga que todo es culpa de Robs. Vengarme.
ham,"Proverbio japonés: si uno puede hacerlo, usted también puede hacerlo, si ninguno puede hacerlo, debe hacerlo versión india: si uno puede hacerlo, déjelo hacerlo... ¡si ninguno puede hacerlo, déjelo! Y finalmente la versión de Kerala: si uno puede hacerlo, deténgase a hacerlo... Si ninguno puede hacerlo, haz una huelga en su contra..."
ham,"Hoy no estoy trabajando, pero no estoy libre de Oso... Gee... ¿estás trabajando en la tienda de tu fren?"
ham,"En la vida, cuando enfrenta opciones, simplemente arroje una moneda, no porque se resuelve la pregunta, pero mientras la moneda en el aire sabrás lo que su corazón espera. Gudni8"
ham,"¿Sabes por qué Dios creó la brecha entre tus dedos...? Para que, uno que está hecho para ti viene y amp; ¡Llena esos vacíos sosteniendo tu mano con amor...!"
ham,Quiero estar allí para poder besarte y sentirte a mi lado
ham,No estoy nada feliz con lo que dices o haciendo
spam,Contenido para adultos 18 Su video estará contigo en breve
ham,"Ok, eso sería encantador, si estás seguro. Piensa en lo que quieras hacer, beber, bailar, comer, cine, entrar, salir, sobre... ¡¡¡¡¡¡¡¡¡¡¡¡¡¡¡¡¡¡¡¡¡¡¡¡¡¡¡¡¡¡¡¡¡¡¡¡¡¡¡¡¡¡¡¡¡¡¡¡¡¡¡¡¡¡¡¡¡¡¡¡¡¡¡ ¿Qué pasa?"
ham,"Lo que quiero decir es que si no le has dicho explícitamente a Nora que conozco a alguien, probablemente no me molestaré."
ham,Smith Waste Da. Quiero gayle.
ham,"Mamá, te he enviado muchos muchos mensajes desde que llegué aquí. Solo quiero saber que en realidad los está recibiendo. Disfruta el resto de tu día."
ham,"Aight, mañana alrededor & lt;#& gt; es"
spam,"Su oportunidad de estar en un show de fantasía de realidad Llame ahora = 08707509020 solo 20p por minuto NTT Ltd, PO Box 1327 Croydon CR9 5WB 0870 es una llamada nacional = tasa."
ham,"De hecho, lo hice por primera vez en mucho tiempo. Me fui a la cama no mucho después de hablar contigo. Me desperté a las 7. ¿Cómo estuvo tu noche?"
ham,¡Nos vemos allí!
ham,No entiendo tu mensaje.
ham,Crucify es c no s. Deberías haberme dicho antes.
ham,"No sé. Sigues diciendo que no lo eres, pero desde que se mudó, seguimos chocando la libertad frente a la responsabilidad. Y estoy cansado. Tengo tanta otra mierda para lidiar con que apenas me mantengo unido una vez que esto se agrega."
ham,Joder Cedar Key y follarla (ven de todos modos aunque)
ham,"Veinte y las cinco, dijo que este tren ya ha sido en Durham o no porque estoy en un asiento reservado"
spam,"Hola chicos. ¿Quieres fotos HOT XXX enviadas directamente a tu teléfono? Porno txt a 69855, 24 horas gratis y luego solo 50p por día. Para detener el texto StopBCM SF WC1N3XX"
ham,¿Sigues pintando tu pared?
ham,La impresora es genial. Me refiero a Groovy. El vino está groviendo
ham,"Hola, el alquiler de Harish ha sido trasladado a su ACNT."
ham,¿Algo que viene ella?
ham,CBE es realmente bueno hoy en día:) muchas tiendas y salas de exhibición:) La ciudad se está formando bien.
ham,Ü ¿Sigues asistiendo a las charlas?
ham,"¡No hay problemas, cariño! ¿Cómo estás en el MO?"
ham,"K, me encargaré de eso"
ham,Supongo que no tuvimos el teléfono llamado el viernes. ¿Podemos asumir que no lo tendremos este año ahora?
ham,Mi batería es baja nena
ham,"Shuhui ha comprado el regalo de Ron, es un reloj de muestra..."
ham,"Sí, queda bastante, me pasaré mañana cuando me levante"
ham,¿Bebé? Dijiste 2 horas y han pasado casi 4... ¿está tu Internet abajo?
ham,"K, me aseguraré de levantarme antes del mediodía y ver qué es lo que es"
ham,K... K... ayer estaba en CBE.
ham,Fui a Ganesh Dress Shop
spam,"PDATE_NOW - Doble mins y 1000 txts en tarifas naranjas. ¡Último Motorola, Sonyericsson y Nokia y Bluetooth gratis! Llame a MobileUpd8 al 08000839402 o llame2optout/! Yhl"
ham,Ü ¿Recolectando su computadora portátil y luego configuraría la configuración de DA Izzit?
ham,"Aight, debería estar allí a los 8 a más tardar, probablemente más cerca de 7. ¿Están Jay y Tyler o deberíamos hacer dos viajes?"
ham,Ven a aftr & lt; decimal & gt;.. ahora estoy limpiando la casa
spam,"Ur, el equilibrio de efectivo actualmente es de 500 libras, para maximizar su efectivo, ahora envíe efectivo a 86688 solo 150p/msg. CC: 08718720201 PO Box 114/14 TCR/W1"
ham,"Bill, como en: ¿Hay alguna letra para mí? Espero uno de Orange que no sea una factura, pero aún puede decir Orange en él."
ham,Dime Pa. ¿Cómo es el dolor de?
ham,"Hola cariño, espero que hayas tenido una buena noche, desearía haber venido no puedo esperar a verte amando a Fran PD, quiero sexo anal sucio y quiero una pandilla de 10 hombres bang"
ham,"Ja. Tampoco lo sabes. Hice una cosa inteligente pero simple con las peras el otro día, perfecto para Navidad."
ham,"Helloooo... ¡despierta..! ""Dulce"" ""mañana"" ""le da la bienvenida"" ""disfruta"" ""este día"" ""con alegría"".. ""gud mrng""."
ham,Alrite
ham,¿Por qué debemos sentarnos y esperar los días de verano para celebrar? Una vista tan mágica cuando los mundos se vistieron de blanco. Oooooh deja que haya nieve.
spam,¡URGENTE! Su número de móvil ha sido otorgado con un premio de £ 2000 garantizado. Llame al 09058094454 desde la línea fija. Reclamación 3030. Válido solo 12 horas
ham,¿Cómo van a ver películas de tu lado?
ham,"No tenías que decirme eso... ahora estoy pensando. Además, va a detener todas tus carreras"
ham,"Por favor, envíe a alguien a nuestro piso antes & lt; decimal & gt; hoy."
spam,¡Lo siento! Todavía no puedes darte a la baja. El paquete de ofertas de la mafia tiene un plazo mínimo de 54 semanas> PLS RECENDE SOLICIÓN DESPUÉS DESPUÉS DEL ESTADO. Responder themob ayuda 4 más información
ham,Nada para... un poco aburrido también... entonces no te vas a casa temprano 2 dormir hoy...
ham,¿A qué hora debo decirle a mi amigo que esté cerca?
ham,Sí. Eso estará bien. Te amo. Estar a salvo.
ham,Gracias chikku..:-) gud nyt:-*
ham,¿Está Xy en tu coche cuando me recoges?
ham,"¡Gracias 4 El tiempo que hemos pasado 2Geva, su bin menta! Eres mi bebé y todo lo que quiero es u! Xxxx"
ham,"Yo, ¿de alguna manera podríamos recoger algo esta noche?"
ham,No lo he enviado. Él puede enviarme.
ham,"Bien, simplemente estoy sentado."
ham,El regalo de Dios para los pájaros como humanos tiene un regalo natural de Dios.
ham,¿Vienes al día para la clase?
ham,He terminado. Solo Studyn en la biblioteca
ham,Ok... disfrutas tus shows...
ham,"¿Dónde estoy sin mi bebé? El pensamiento solo ácaro rompe y no quiero volverme loco, pero todos necesitan a su dama xxxxxxxx"
ham,¿Qué es mi querido haciendo? ¿Durmiendo ah?
ham,Hola 'prueba en & lt;#& gt; rd....
ham,Solo el 2% de los estudiantes resolvieron esta pregunta de CAT en 'xam... 5+3+2 = & lt;#& gt; 9+2+4 = & lt;#& gt; 8+6+3 = & lt;#& gt; Entonces 7+2+5 =????? Dime la respuesta si eres brillante... algo. Tengo una respuesta.
ham,"¿Conoces a alguien y lt;#& gt; ¿O capaz de comprar licor? Nuestro chico se desprende y ahora mismo si no nos apoderamos de alguien, es solo 4 Loko toda la noche"
ham,"Sí, su fren lor. Me encuentro con mi fren a los 730."
ham,"Sí, tenemos uno alineado para nosotros"
ham,"Y deja de preguntarte ""¡Guau, alguna vez va a dejar de hacerlo?"" Porque te voy a ser cuando quiera porque eres mía... *risas *"
ham,Lol yep lo hizo ayer. Ya tengo mi chimenea. Ahora es solo otro ícono sentado para mí.
ham,"Oye, ya he reservado la lección de Pilates and Yoga... jaja"
ham,Estás bien. ¿Qué pasa para comportarse así?
spam,Tienes 1 nuevo mensaje. Llame al 08712400200.
ham,Mi supervisor me encuentra 4 para que yo sea sus alumnos. No le he preguntado todavía. Dile a popa que le pregunto.
ham,"Hola. No hay noticias sobre el trabajo, ¡me están haciendo esperar una quinta semana! Sí, estoy preparado para algunos wozles y comadrejas... en Exeter todavía, pero tengo en casa unos 3."
spam,"Actualmente tenemos un mensaje en espera de su colección. Para recopilar su mensaje, simplemente llame al 08718723815."
ham,"Oye, nena, lo siento, no había llegado antes. Gary puede venir y arreglarlo porque cree que sabe lo que es, pero no llega tan lejos un PTBO y dice que costará & lt;#& gt; dólares. No sé si podría ser más barato encontrar a alguien allí. No tenemos ninguna máquina de segunda mano en este momento, déjame saber lo que quieres hacer nena"
ham,¡Haz eso 3! ¿4 joder? incógnita
ham,Déjalo. Siempre serás ignorante.
ham,"No, pero voy a ir 2 sch en viernes bastante temprano para tener sis my sis tiene papel en la mañana:-)"
ham,En Bruce B Downs & amp; Fletcher ahora
ham,Dónde estás? Dijiste que estarías aquí cuando desperté...:-(
ham,"Oye, ahora soy libre, puedes llamarme."
ham,Dime quién es esto por favor:-)
spam,"¡URGENTE! Su móvil recibió un Premio de Llama de Bonos de £ 1,500 el 27/6/03. ¡Nuestro último intento 2 contacte a usted! Llame al 08714714011"
ham,"Creo que podría tener que perderlo. Estoy enseñando hasta doce, luego tengo una conferencia a las dos. Maldita sea, esto funcione."
ham,"Tengo que verificar, pero solo hay como 1 tazones que valen"
ham,Si había muchos dulces
ham,"Lo haría, pero todavía soy acogedor. Y agotado de anoche. Nobody fue a la escuela o al trabajo. Todo está cerrado."
ham,¡Zumbido! *sonríe* ¿Te zumbé el culo? ¿Zumbir tu pecho? ¿Zumbir tu polla? ¿Dónde guardas tu teléfono? ¿Está encendido el vibrador? ¿Sentiste que temblaba?
ham,Señor envíe al grupo por correo. Compruébalo.
ham,Estoy haciendo DA Intropción de tendencias energéticas n Pros n contras... Breve descripción de la fusión nuclear n Oso breve Historia de Iter n jet obtuvo 7 n media páginas..
ham,¡NINGUNO!¡EN NINGUNA PARTE IKNO HACE DESCUENTO!SHITINNIT
ham,No sabes que me jabo abi.
spam,"¿Alguna vez notas que cuando conduces, cualquiera va más lento que tú es un idiota y todos conducen más rápido que tú es un maníaco?"
ham,Todavía no lo había hecho... ya sapna tía manege y'day hogidhe...chinnu full débil y swalpa black agidhane...
ham,"¿Estás siendo bueno, bebé?:)"
ham,"Principalmente tipo deportivo... lyk footbl, crckt.."
ham,MA Head dey Swellh oh. Gracias por alegrarme el día
ham,Deberías hacer una lista de FB
ham,"Altura de la confianza: todos los profesores de aeronáutica fueron llamadas y amp; Se pidieron 2 sentarse en un avión. AFTR se sentaron, le dijeron a ese avión que realizó sus alumnos. Dey todo se apresuró al avión D... bt solo no se movió... Dijo: ""Si mis alumnos lo hacen, esto ni siquiera comenzará..... Datz Confidence.."
ham,"¡Sary solo necesita a Tim en el bollox y le dolió mucho, así que me lo dijo!"
ham,¡Feliz año nuevo princesa!
ham,"Le enviaré un mensaje de texto a Carlos y te lo haré saber, espera"
ham,"¡No se preocupe, * es fácil una vez que tenga ingredientes!"
ham,Te amo 2 mi pequeño poquio campanino lo siento pero te amo
ham,"Ok Omw ahora, ¿estás en Castor?"
ham,Yar lor... Sigue lloviendo sin parar... ¿O quieres ir a otro lado?
spam,"¡Oferta de Navidad! ¡Lo último de Motorola, SonyEricsson y Nokia y Bluetooth o DVD GRATIS! Doble minutos y 1000 mensajes de texto en Orange. Llame a MobileUpd8 al 08000839402 o call2optout/4QF2"
ham,"¿Qué quieres decir con que casi terminaste? Hecho con durmiendo? Pero me vas a tomar una siesta... sí, le envío liao, así que la estoy recogiendo en ard 4 smth lor.."
ham,"¿Esta noche? Sí, estaría deprimido por eso"
ham,¿Qué debo comer para el almuerzo senor?
ham,"¡Dijo que tenía una risita correcta cuando te volvió a ver! Posiblemente sea la primera persona2Die de NVQ, ¡pero piensa por cuánto podrías?"
ham,No hay tiempo de descanso uno... ¿Cómo... salgo y obtengo mis cosas de ü?
spam,¡Responder para ganar £ 100 semanalmente! ¿Qué deporte profesional juega Tiger Woods? Envíe una parada al 87239 para finalizar el servicio
ham,"Estoy allí y puedo verte, pero ¿no puedes verme? ¿Quizás deberías reiniciar YM? Vi el zumbido"
ham,¿Todavía tienes el molinillo?
spam,No 1 Tono polifónico 4 ¡Ur Mob cada semana! Solo txt pt2 a 87575. ¡1er tono gratis! Así que consigue a Txtin ahora y cuéntale a tus amigos. 150p/tono. 16 Respuesta HL 4info
ham,"El amor no es una decisión, es un sentimiento. Si pudiéramos decidir a quién amar, entonces la vida sería mucho más simple, pero menos mágica."
ham,K.i no te vi.:)K:) ¿Dónde estás ahora?
ham,Así que estoy haciendo una lista de compradores.
ham,"No tengo idea, supongo que lo resolveremos una hora después de que se supone que debemos irnos, ya que, como de costumbre, nadie tiene interés en resolver la mierda antes del último segundo"
ham,"Mm no está completamente seguro de haber entendido ese texto, pero oye. Ho. ¿Qué fin de semana?"
ham,"Lanzaron camisetas Vday y cuando te las pones, tu trasero queda medio desnudo en lugar de esa ropa interior blanca."
ham,No lo sé... está viendo películas en la computadora.
ham,No B4 Jueves
ham,"Oh, entonces tu teléfono me llamó pero se desconectó"
ham,La identificación solo importa cuando salgo del campus
spam,Este mensaje es gratis. ¡Bienvenido al nuevo y mejorado club de Sexo y Dogging! Para darse de baja de este servicio responda STOP. mensajes@150p 18+solo
ham,"Excelente, veré cuáles son los planes de Riley"
ham,EW ¿Eres uno de ellos?
ham,También hola wesley como has estado
ham,"Ah, ves. Tienes que estar en la jerga. ¡Te haré saber WOT en la Tierra cuando ha terminado de hacerlo!"
spam,"Préstamo para cualquier propósito £ 500 - £ 75 000. Se admiten propietarios e inquilinos. ¿Le han rechazado anteriormente? Todavía podemos ayudar. Llame gratis al 0800 1956669 o envíe un mensaje de texto con ""ayuda"""
spam,Update_now - 12mths Half Price Orange Line Alquiler: 400 minutos... Llame a MobileUpd8 al 08000839402 o call2optout = J5Q
ham,Imagina la vida sin mí... mira... ¿qué tan rápido me estás buscando? No te preocupes... siempre estoy ahí para molestarte...
ham,"Hm buenos días, ¿alguien de cabeza?:-)"
ham,"Sí, no hay problemas, anoche obviamente se está psoloendo al día contigo... hable pronto"
spam,"Porno hardcore ilimitado gratuito directo 2 Su porno móvil TXT a 69200 y obtenga acceso gratuito durante 24 horas, luego chrgd@50p por día txt stop 2Exit. Este msg es gratis"
ham,Podría ir 2 sch. Yar en E Salon ahora v Boring.
ham,& lt;#& gt; Mins pero tuve que parar en algún lugar primero.
